text,label
laser gun need,0
fuck cop pussy,1
happen would drive though cop shit mess let finish say like need get home work see long line car hold people bullshit,1
dislikes white people offend think racism not issue anymore think,1
dare sand storm,0
would love see pussy go staten island spit cop would love see happen mike brown strong arm thug people burn ferguson eric garner nothing wrong choke death no protest mafia control staten island no burn car nothing,1
wake black people,0
people country go learn not police enemy medium one light call fire stir pot,0
interviewer right guy show respect paramilitary police kill get away ha,1
man guy nothing bunch waffle nonsense come mouth answer question,1
like turtle,0
speak other want say,0
god look raw footage shock ferguson riot watch see guy god,0
fuck idiot get way people get get work,1
answer 24 15 question aim leg,0
really sad story someone kill no reason racial war increase devil must see officer victim guy cause action let we pray soul,0
deadly force fine line not either side brutal no winning,0
welcome new world order,1
see article many case go pretty much one particular one make big scene,0
give keys county snowplow get road open soon possible,1
yea beat white people rob black own store massive riot waste money bet 90 not work stop waste people money hope every single person get shoot not happen though sadly,1
somebody pick gun kill cop already la style,1
290 charge armed cop dangerous weapon,0
cop protester steal destroy thing not solve shit,1
peggy bless much courage heart thank honesty passion matter whatawoman,0
community march peace hand hand girl kill sit home homework deserve least society let maybe al sharpen lead,0
wow need get shit straight never weapon point one ready position due riot understandable course action one know anything,0
michael brown much research see opinion man dangerous enough rob store without weapon dangerous criminal anything gentle giant proof show brown attack wilson peace officer begin not race issue government medium create race issue attack constitutional right anything,0
10 legend still yell move,0
much hatred people,0
wow hole make interviewer seem reasonable balanced,1
ah memory way bring firework,0
law protester block street legal allow run,1
wrong mother fucker no shoot apprehend,1
legalize marijuana problem stop,0
fact prove thug,1
ireland england riot 1995,0
one part hard believe guy run officer shot drug know would illicit type behavior pop,0
virginia,0
easy point negative black man point good point white man shit corny want taken seriously tell fact good bad party know couple lyric picture show middle finger justify shoot 6times medium say control look around internet store owner micheal brown allegedly steal cigar say not micheal brown video bogus think everything happen cop vs black man recent year make sen black man start beat policeman run away policeman start fire micheal stop rush back police gun draw already fire shot pure bullshit,1
kill protester,1
bullyrag,1
wow people like not say thing rightly say pa police get offend tag racist therefore no truth might speak give credence society know speak truth magnifie like no one else could not elevate people like school board city council mayor state national office,0
exactly right stefan crime bad decision create poverty poor unattractive area criminal not steal necessity get respect homie pathetic,1
video racist,0
character not matter armed kill hand damn could arrest not kill fuck let get away murder kill boy steal cigar,0
would eat coal could roll,1
allivesmatter,0
shabby libby ignoramus ass bitch,1
delusional moron anger justify mike indeed unjustly kill hand mike malicious person shoot justify rioting not justify no one know happen day riot take place basis assumption,1
would not waist time try reason police spit thug try defend criminal brown losing matter grand jury make decision live,1
not care protest one run punk ass hope get run,1
everyone know white people die cop black even though black get arrest double rate white less arrest end shooting less people kill police black courtesy bi statistic maybe worry black commit much crime yet number general population oh ten year ago crime rate employment rate black well,0
good balanced unbiased video story sad shake head,0
michael smerconish hack,0
remember send national defense,0
time test police gun fire fire,1
stop advertise swisher sweet laugh loud racist point blank,1
black tired kill nothing not weapon shut ass white devil white people evil,1
mari unemployed,1
time sequence event wrong no 911 call make report robbery officer darren wilson not dispatch crime scene even police chief say publicly,0
look mike brown world instrumental,0
clearly racist shrill canadian vegetable plant live box ivory snow truly know nothing negro race,1
thank,0
ms hubbard absolute respect wish would run office level get big ball male politician call like bravo,0
honestly believe mike brown actually try take cop gun cop sit car would stupid think kid would charge someone point gun beast high high could mike go store everything else easily epic fail sir not make officer take toxicology test officer obviously scare go use weapon per intimidate mike size officer not know mike steal anything tell dispatcher know nothing shoot area get fact straight please,1
police clean mess quick nice,1
need stop act like mike brown innocent guy never nothing wrong,0
case overshadow cop murder kid fake sword saratoga spring utah much outraged mike brown case murder happen utah deal cop provide non lethal weapon shoot utah unwarranted run not know run lunge police fake sword take opportunity immediate action right run shoot times back know large group cop corrupt murderer nothing new though run police many time teen cop pursue find hiding not put bullet back end life say paper saratoga spring black population would say,0
well see looting protest would say would not high exhibit poor decision making also not impressed anyone go college college not use pretty much extend childhood people go,0
people not get not want get shoot not act like thug threaten police officer eff ridiculous excuse act like asshole oh good job destroy city,1
informative really appreciate video,0
brown issue excuse loot take people shit destroy neighborhood typical ghetto bullshit not even hood ghetto bitch collect free rent govt fighting govt occupy wall street facet nothing else go clean highway,1
think waste skin catch desert 3300fps would not make popular guy no free people allow party not live bookend country rest mishit would justice know majority real americans despise every way know every day continue exist sing must yang motherjumper,1
dear mister stefan molyneux not add video regard michael brown ferguson pd horrible history lie corruption smart think not make statement massive authoritarian corruption negative impact community serve people eventually get feed no choice disregard law fight back cop merit charge mister brown indeed happen,0
law not prosecute run people block street sure know go win people laugh loud,1
one mustang need situation laugh loud skull skull,1
not get cop armed civil war machine gun unarmed civilian throw brick fuck united states people america must free oppression,1
get time work ok,0
good opinion yet definitely would use deadly force someone charge assault prior carry gun everywhere go world get crazy thank share everyone know,0
fuck peaceful gun gas human road block problem solve,1
stupid arab police shoot apprehend laugh ass not work attack,1
love thing go peggy stupid killing self quick stop could ever makeup,0
respectable woman,0
guy 34 get hard,0
ok mishit not care foot tall 600 pound call backup use pepper spray use baton use laser wait backup use gun say go monkey blindfold hand tie behind back anyways preliminary autopsy show shoot time less lethal area execute gunshot wound head,1
truly sad people stop roadway simply walk protestor inform 30 second go use punching bag boy girl not move not disband lie bitch need ass kick far cop not even one citation write bitch cop,1
ferguson like american city not prison resident feel mistreat discriminated subject illegal search seizure advice move country vast confident find somewhere great nation find place happy successful,0
laugh loud police beginning sound like say moo move cow mean cop maybe feel like cop mean cow,0
ignorant coward full emotion estrogen apathy hell come fuck racially ambiguous blackwashed loudmouth really choose pathetic man interview,1
amazing info police officer give award could not find nothing else plus witness support oppose view state friend officer wilson wife say repeatedly fact nothing hit piece michael brown long take tell truth day still not statement officer quick release dirt micheal brown smelling yet wait see video catch incident not take plus day show write report unless fill lie truth not change not need preparation simply tell,0
would press button shoot tsar bomber car,1
twitter powerful blunt force trauma powerful hope word change think whose concern black life misplace thank sharing,0
vice news dispatch,0
another bullshit vice documentary not focus fact idiot no job vent racist paranoia,1
run,1
black officer shoot white guy would fine black people not racist,1
white child deserve future ten million non white flood white country every year decade mean white minority every country found black country remain majority black asian country remain majority asian white country affect genocide international law anti white not call genocide call diversity diversity mean chase every last white child anti racist codeword anti white,1
cell phone video show anymore get sorry message say private,0
oh god terrorist isis undercover agent americans arrest,1
obviously not matter smoke marijuana family autopsy says not shoot back unbiased witness clearly state time mb come officer no mention hand witness michael brown shooting repeat time dude keep come towards police,0
not inform 100 exactly going fuck try find reliable resource understand not believe 2014 thing like still happen,0
wow,0
funny thing government trust judge fuck disgusting,1
run,1
say,0
injustice white kid would excuse,1
day day thisisacommentary truth,0
no long allegedly michael brown video confirm family,0
well do thumbs_up,0
congrat get town flame roll live 3rd world hell hole also try move oh wait not town garbage probably business market,0
right dynamite,0
want toss one grenade laugh loud not anyone course range would fuck shit,1
aim gun people say something not like extremely american america broken system,0
bravo,0
let we look fact move away shot fire witness arm shot fire witness drop knee shoot fire witness audio recording 10 12 shot two group video recording spontaneous utterance hand et fight officer officer other fight weapon car officer other weapon discharge car officer other damage officer eye medical report not release officer statement not release police log incident radio report not release forget third review wound show shoot least twice witness yet support unofficial officer version incident,0
feel sorry happen thus think not happen gang member kill another one go street cop kill black male know gang member kill every day lose family friend no one go street scream stop kill police kill black person whole world stop human,0
amen peggy hubbard color make no difference person inside innocent nine year old little girl one attention people want cause chaos black white go exactly obama want look country mess admire courage tell like peggy hubbard,1
people ask peace riot bring violence,0
difference color skin people still say,0
genuine failure leadership president united states nice town ferguson declare state emergency put martial law federal troop stuff town non resident push everyone know go another riot president not want offend black community not want anyone else get shoot let er burn baby burn seem real leader could way mister president sir fail reprehensibly accuse,1
yes let we destroy someone else property ruin day mad someone else take police cunt,1
black get prejudice easily,1
fate another neglect child would interesting know family background always keep mind child emulate social behavior,0
weak display law enforcement,1
supra need let happen,0
police charge,0
great video level head cogent fair unfortunately cognitive dissonance confirmation bias take hold whole discussion breath fresh air thank stefan,0
america,0
would get car start burnout face either move get smoke,1
mister mari 100 right could not say well,0
not one pair work boot steal ferguson riot,1
like say hurt instead,0
nice lorry driver need run fuck,1
police concentrate investigation people call misbehave hope investigation get cancel behave let police work everyone say guy commit suicide cop attack police first place clear not disrespect police way,1
next time line car start make burnout smoke riot gas non lethal efficient double check actually non lethal course ad,1
great video thank peggy,0
would bring ar 15 would do job not care go jail nog would deserve,1
must mad quiet lose belt,0
german police pretty nice even would beat protestor,0
would pop couple shot air watch scatter like roach light turn,1
hope fucker get slam major fine fuck idiot,1
thank mrs hubbard happy say need say black allow neighborhood destroy black mother stand count black father keep ass home help raise child peggy chief back fair wind follow sea shipmate slap hear round world need happen whole lot sister,0
love woman wish like would certainly help page,0
chief not black lying,0
