text,label
right loot right private property right destroy public property play victim card nothing change,0
not taker,0
mister browns side oh dead,0
amen tell like sister aman,0
crazy thing think office never anything want random people,0
watch zimmerman case video full shit smell hate seep bring rap music listen sound cloud nothing make character look foolish dangerous possible ever want respond fuck well go much effort destroy mike brown character bring smoking habit nothing get shoot tone perfectly choose word use really make brown look like unstable look much detail go thu slay brown character,1
god narrator annoying lisp,0
law enforcement not train shoot apprehend train shoot kill thank wilson kill punk bitch,1
johnathan gentry november 24 59pm no winner loser case heart prayer go michael brown family darren wilson family current leader seek make racial issue try divide country worker satan,0
mike brown criminal thug fuck,1
yes right white shot black hell break lose black shot black no protest maybe start protest black shooting black buy story,1
laugh loud crayon online name nolimitnigga people get mad piece human trash like get shoot,1
war 400 year please war start three quarter million americans die stop bitch,1
man zionist jew look see newness face employ zionist sympathizer no con racist wolf blitz employee,1
anyone know irradiating commercial strawberry seed mine not germinate,0
call anarchist defend cop shoot unarmed civilian highly disappointed beginning video refer square not know blunt much bad stefan incredibly touch evidence complete ignorance towards black hip hop culture slang start smoke blunt listen hip hop would likely gain enlighten understand life like low class america,0
plenty white people care exact view woman deem racist stop care,0
guess never do anything wrong life accord analysis police right shoot six time make sure dead already dead proud officer tell everything hope child,0
protester suck,1
maybe not know exact story understand suppose case grow man shoot kid not suppose racial guy let hate whether anti black anti white seem forget go police officer shoot innocent kid want justice not fuck race moment pick race side become fuck joke not give rat ass many black kill white vice verse want know fuck police officer walk free empty motherfucke gun child,1
hilarious seeing moron get hit car,1
comment nothing topic video someone please set stefan rap actual beat would epic,0
manner ball bey not thug work fedex not house serve warrant not video brandish gun shoot back illegal us police officer st louis pd not release datum know shot kill error ball bey no criminal record hubbard illegal go national slandering ball bey son frankly would sue,0
fuck dumb attention whore cause problem,1
not brown daily killing non white white cop reality,0
could not help laugh start recite rap lyric good,0
bitch talk people like dylan roof james holmes jared laughter jehad miller tim mcveigh jared laughter jim david admission paul hill scott order frazier glen miller jr elliot rodger buford furrow john house et right,1
freak 2014 people still racist police still awful,1
dirty mongrel,1
black life splatter,1
experience racism side racist white,0
arrest block highway want protest somewhere else,0
would satisfy someone throw molotov middle group,1
mrs hubbard get pamela golden die needlessly,0
obstruct interstate commerce federal felony offense cop useless bum democrats modern version racist terroristic ok also create not protester rioter driver first row car wimp imagine die ambulance stop traffic jam miles long,1
not muffin,0
nicely do,0
not stop revolution well year would say do pretty good job far,0
truck foghorn,0
not county go back middle east county,1
no dumber people earth american,1
run,1
great,0
love rap section,0
tell break law block interstate traffic let get hit vehicle tell leave not driver vehicle not charge injury incur bill retards standing street,1
darren wilson stand trial prove act self defense jury open court law george zimmerman michael dunn could not grand jury operate secret not trust no government trust operate secret,0
guess suck construction worker show prove entire video wrong,1
criminal kid get shoot police almost everyday plus mike brown bad criminal record start fight,0
us government kill population,1
parent one kid fail one job parent not raise cunt,1
guess misread joe ever see anyone put place swiftly eloquently not even sure realize,0
live final day go get bad,0
run black cunt,1
leave video sometimes truth hurt thank post video,0
black,1
not let elite divide conquer tactic work want keep we racially divide never rise,1
thus collapse we two possibility consider whereby one boil dictatorship evil reprisal possibility may new reconstruction people fundamentally conscious responsibility attain government really everything bring effective valuable new start whether actually occur currently extremely questionable presently totalitarian manner everything direct towards interest economic military political cultural well towards strict fundamentalist religious sectarian base enormous lie devious misanthropic criminal felonious machination every imaginable regard also mean population we spy upon secret service even severely within neighborhood forth every possible manner restrict freedom addition violence emerge form openly covertly,0
thank right black people go vote 100 democrat year race bait democrats rally base shake head,0
sad god still control know tired michael darren wrong right god know let last judge,0
fuck douche bag,1
go viral already view 100 00 police we,0
joke,1
find channel one fan already thank kid excellent,0
flat racist say one race not represent another equally majority black vote white people mean black voted not vote good interest elect white official not represent black voter put office,0
thank finally powerful voice truth black community 93 black killing perpetrate black part even black murder non black not direct innocent black citizen rather drug gang relate donald trump star parker hope aware peggy hubbard comment address issue honestly need seat table ms hubbard trump campaign administration race monger like obama eric holder pesos reid jessie jackson al sharpen nap congressional black caucus congressional democrats ethnicity level government mainstream medium conspire last 50 year turn viable black community government dependent ghetto knowingly advance false narrative systemic white conservative racism perhaps great accomplishment destruction black nuclear family seventy two percent black child bear single mother get married limit number child obama progressive gladly extort taxpayer money take care illegitimate child exchange guarantee vote keep power master plan policy insure generation newly create disaffect dysfunctional adult necessarily become democratic voter race hustler mention react way black black killing could go neighborhood power wipe gang minimize drug use give community real hope change never happen need black community dependent feel hopeless order maintain power control live good life back people deceive thinking care think purveyor lie damn lie could not make race issue past 40 year would get real job like rest we,0
thank voice sanity black community peggy,0
guy hire idiot,1
bored stupid kid,1
run everyone,1
sure avoid get guy taxi cab,0
upset court ruling upset close whole freeway go main airline ticket america freedom speech active right,0
scroll comment see bunch racist comment look trump supporter sits patiently hate ok seriously lot people say wrong say yes kind people say black think african american people innocent nothing wrong,0
united shits america collapse good,1
great video although wish would focused shit police thing keep rioter supporter complete idiot,1
think kill,1
not dude get knock phone steal ferguson,0
via agent provocateur operative kick start riot new american civil war not african american rehearse ebonic transparent,0
also love show picture brown angel not tug,1
say 13 minute could easily rap call duty white kid play way pretty sure eminem sum white lyric go racism,0
mike browns father make say bullshit,1
dear peggy please mother run president,0
actually shout fire crowd theater christopher kitchen demonstrate talk free speech look interviewee correct cop serve public not way around consistent serve public police department represent public race ethnicity rank hire bunch big tough black guy police department few black shoot death puny white guy feel humiliate get bitch slap teenager,1
everyone want next milk issue not problem we anymore require another milk,0
guy idiot well lose already bozo,1
man intelligence average black man not comprehend like dog try figure man make house,1
real strong black woman not afraid speak truth,0
white racist always comment section glad white exterminate another 100 year no white peace earth,1
corrupt police harm not safe defend self fight back shoot dead get ready catalyst fact city town government us catalyst pot boil many year generation bring equalizer door step also purge feel effect,1
rob store big man play fire get burn police job,0
stuff like one reason people associate violence danger black people,1
ram prick,1
youtube com watch 6yfbbt6dvhg research not come across information white construction worker witness mike brown shoot hand,0
tell fact steal swisher sweet value life admit racist quit bunch faggot bitch,1
people see mississippi burn way many damn time,0
good one stefan,0
run,1
update apologize fair report,0
kid would beat shit,1
someone say way black people behave no wonder ferguson shitty place black people we fuck lazy say countless example life grandmother get black house nurse bitch nothing day grandmother complain agency send different woman not black clean entire house hour mom work hospital nurse black co worker constantly nothing lazy not black people like one good friend black like like brother fuck expect get everything want ancestor slave well hitler kill ancestor see sag pant cry like stupid bitch like stupid black people inequality representation probably black people generally lazy lack skill require hold position household income tie previous point lazy lacking skill low income job dropout rate school need take black people ferguson hold high pay job not even graduate fuck high school 80 bad healthcare tie low income money well doctor inequality enforcement give one completely unfair however look black officer frisk mostly black people well hmm interesting maybe,1
night love victim situation separate black people need,1
40 someone get milk,0
dumb mf,1
basically talk black life matter guess loot rioting take place asshole whose rob drug community hit point believe police brutality want reform know racism also know nobody go take fucking second look black right till black people take stand self destruction,0
need shoot racist fucktard,1
hope god guy still not fall old banana tailpipe bullshit news give,1
please slow not tell speed ms sully talk really quickly great video great information little fast,0
know crazy actually come across video bitching try learn knew look familiar take time look mike browns personal profile specifically soundcloud think guilty represent wrong light maybe steal still not deserve die fact white people like continue insinuate ridiculous show clear lack empathy sympathy seem like animal think especially offensive look back video year later hip hop rob black culture big thing medium still not understand perspective say crayon martin make lean video show ignorant truly well sprite santa carbonate drink use make lean not tea,1
obviously rap not crime face indicative poor character aesop rock rap not rap murder people beat shit people fun rap stuff stuff speak volumes character want perceive world absolutely relevant,0
peggy love video use stand black life matter use excuse get away crime know lot good black would like voice hear voice silence nationwide uproar black life matter afraid say something could next victim,0
word provocateur,0
least favorite test tube video far,0
couple thing miss side argument firstly yes guy dead dead crime scene course not cover body secondly officer seems not call incident base multiple source odd addition make no excuse strong armed robbery not understand money weed need rob cigar regardless not excuse get shot street even ignore eyewitness account assume lie shot blatantly excessive lastly admit rap not law mention rap not law thing come close smoking marijuana course legal state get fight teenager always,0
protester throw stuff reporter,0
run,1
run,1
shocking truth come light,0
12 28 someone please turn auto tune rap song stefan molyneux please,0
awesome woman,0
major difference zimmerman case one shooter zimmerman name not withhold take custody news medium able document zimmerman injury immediately case handle horribly lack immediate transparency even everything true po question cover also community history police abuse miss video allege abuse occur response media peaceful protester also show complete lack understand escalation unlike authority deal potential zimmerman loot riots pd case attack protester rather station near loot target protect business criminal always take opportunity distraction like storm blackout protest loot authority know know great propaganda protester see loot rather pd fail protect business also illustrate 2nd amendment valuable business owner depend pd protection get loot business owner depend right bear arm not loot,0
tip hat class lady well speak,0
people not realize block road piss people not get people onto side,0
alright entire case crap people say white people racist call bad name racist would like call we extensive investigation prove boy death self defense however not defend whole ok thing defend helpless citizen ferguson boy died not care white black care people ferguson treat town really cared incident would hold memorial express feeling not help get justice really matter boy dead something do grand jury decide,0
not like generalization use rant main point right chris rock say good black people nigger night morn killer get gun street black person mourn loss innocent human life little girl get murder base comment black night ratio drop,1
hear billionaire fund organized riot fuck suck joke,1
whether right wrong michael brown case nothing leave wing policy please stop conflate issue,0
show violent protest,0
peggy hubbard president 2016,0
believe whatever want believe not care say basset mari idiot,1
holy shit thought crayon martin supporter imbecile michael brown clown must dope,1
95 policing problem protest cause black criminal let we not forget blame address elephant room,1
ah love country,0
vile cunt,1
tear gas geneva convention hahahahahahahah,1
agree say not trust police not arrest crooked pedophile protect treasonous politician thing military people,1
blacklivesdontmatter,1
house guy going far tell bad go happen bad going benefit not care much money ellen well like rest careful put put russia careful kid,0
obama say exactly lady say instead defend thug clean language however,1
stefan excellent obviously well understand event surround unfortunate event president call unfortunate officer wilson life destroy job fear police hesitate find rapidly grow situation thank depth honest dissertation tom keller seek help go back school get drug,1
oh god put tell truth hard true,0
man stefan,0
people would take step back not make case not anyone except two people situation lump mess take matter hand make kind protest selfish without rational thought investigation guy video heavily emotional hyped want hear get hear press never reasonable discussion kudo smerconish keeping level whole time let mari make fool dare tear city protest make dishonor entire incident hate way since police brutality become epidemic wish everyone would stop pretend like know exactly go no measurable amount people honestly witness incident none we clue way whole issue swing grand jury inform trust majority rule right course action let also thank 99 99 police officer america actually serve protect even bit jerk pull respect job know someone many people go pout hold accountable action people hate police need officer two around emergency,0
pepper spray create dangerous situation motorist get put jail not peaceful protest infringe upon citizen right move freely not due blockade call protestor create dangerous situation,0
stefan molyneux not give rounded view simply want use old tired ploy discredit michael brown no sane person would believe officer wilson perfect angelic white man no person exist not privy questionable characteristic cop rest assure human nature spite brown smoking weed steal blunt even rap bitch gun et not justify someone unarmed shoot many time desensitize culture hip hop white people also monetarily benefit,0
burn tear gas pepper spray,0
smirconnish even hand guy world guy mari idiot,1
not understand black community want rally behind want thug video guy robbing store come would thought protester would gone home michael brown turd crowd full racist hate white community,1
right finally sane opinion event black bastard ignorant run around yell looting carry like la riot old shit,1
real criminal wall street guy steal money inmate every penitentiary every dream steal,1
see bunch ignorant fuck try hard turn racial thing never racial thing start self defense plane simple attack cop ass go get shoot,1
sure totally look factual evidence trial like special treatment hey know go happen not,1
peggy hero,0
god bless police,0
shit serve medium concoct story white cop kill innocent black teenager bullshit get black community arm burn shit story useless talking head get front camera least week see black white crime report news no national attention no federal involvement fuck black man need stand father stop look excuse fuck,1
teen face life prison pot brownie 90 year old man get arrest feed poor police officer set free no charge whatsoever kill teenager not people see wrong,0
molyneux tee de need,0
accelerate go fast enough no one able film plate time,1
we police logic shit brick shoot quick call army nuke,1
yep muslim bitch,1
fuck brain dead let nazi police scum bag take,1
tree tote hilary grip revolutionary regular poster afro punk seventeen massive corporate sponsor revolution start sponsor follow mufti national corporations ha ha ha virtue signal satire practically write,0
blood street worry word get tired way mainstream medium treat we like idiot follow condescend irrelevant distracting disparage narrative step,0
focus happen officer confront brown lead death nothing else matter focus,0
find satisfying reason,1
section lady gentleman see black people misbehave wonder would happen everyone riot court decision not go way,1
real black leadership real revolutionary radicalism,0
white move ferguson let we see nice become east st louis detroit baltimore thing happen look city,1
buy ak47 shoot we cop,1
inanimate object police car resilient get completely flip set fire,0
black cop kill white kid black kid kill white cop anyone riot protest engage national news no race not mention either circumstance think ask question answer honestly real racist country,1
lot people entire medium miss huge crucial point micheal brown even stop first place day happen officer say mike brown walking street day later rob convenience store despite fact owner say store never rob officer apparently fear life pd claim seriously injure altercation mike brown even though video show officer perfectly fine stand mike body hour shooting also mike body 35 foot away officer mike apparently charge man police full shit not see shit make either bigot fuck idiot,1
shoot someone run laugh loud,0
truly tragedy not death kid way city react not way get justice make matter bad malcolm way handle thing not dr king way,0
not really race issue police brutality issue not first time cop like darren wilson not send jail group police officer shoot kill homeless white man not want leave spot home shot attack canines shot bean bag long dead even camera not go jail problem police keep ignore get worse bad not try make excuse bad police officer behavior thankful one job right,0
run motherfucker,1
reason ram move back lot angel 2016,0
guy hero,0
truth people need realize accept michael browns action bring situation bible say justice not serve fast not put justice people say no justice no peace word wake scripture head deeply say not speak everything wish speak right long believe would say come right time,0
interesting informative,0
great interview,0
16 screw price crap think cool disrespect american flag,1
stefan like standup darren wilson though side event lose integrity give clean chit consider incompetent ferguson police turn,0
dude commit felony include assault police officer shoot kill serious race riot distract fact cop job case closed justice serve street day,0
shoot looter sight,1
arab rap 14 go ahead pro laugh loud ghetto,1
techno party,0
no leave alone not take,0
always easy second guess someone cop get lot training end day still human navy seal think human make mistake unless make robot cop continue mistake make also medium play big part issue white co kill black man black cop kill black man would not even make news probably need get long stop make everything race issue good citizen not issue cop young man not saint not gentle giant say rob store probably thing happen cop explain god people involve know exactly happen,0
protester look like kid 16 22 wonder anyone get license plate number pretty wild bunch kid could much damage infrastructure pathetically weak,0
publish aug 17 truth still uncover know likely not assume know entire story investigate fed go investigate pd go back year not case think go know time go assume know answer look microscope mislead people,0
airbag include,1
black life matter white life matter live matter,0
look like medium come bogus clam cause division side thing question not much not people see truth government planing medium fuel,0
much logic intelligence must mixed race intelligent white na,1
put civilian perspective two people get fight one get shot go jail since cop protect self micheal brown shoot 151 foot away daren wilson patrol car no way could not get self situation continue conflict two no reason shoot option like pepper spray tater,0
finish video gaze upon racist bigot comment section make glad human,1
ana fucking hot,1
forget add timeline suspect also assault owner store threaten,0
people facebook tie isis terrorist group muslim extremist,1
show title not belong host name,0
history mankind people color creed culture find way rise ashe oppression self betterment self preservation except black please enlighten unknown phenomenon,1
not wait jesus come back could take care get sick tired racist white people racist black people damn get along black man love white people black people away hate heart try love hate go take we hell need come together god child not ok black power we,0
run mdrfckr,1
would keep go get hit get hit would slowly push way people need grow fuck,1
wow common sense 20014 refresh great job stefan molyneux,0
laugh fuck ass dude taking like hear talk not know say shake head,0
well go young white man kill non white say black cop no media outcry almost no medium anything search,0
need come together,0
fuck,0
idiot,1
stephan watch quite first post truth henry kissinger would interested hearing opinion man ty,0
bill cosby cause,0
love organ no tear gas not geneva convention laugh loud mustard gas burn rib inside vomit sorry say,0
know say wow,0
stefan molyneux please explain inquiry handle subsequent unrest circular language game pretty simple straightforward question seem avoid unnecessarily hostile manner justification heavy hand militaristic response loot would official handle situation decide initially block access area medium family member live area att professionalism hostility law enforcement handle early incorrect info please direct toward fact regard still not understand go straight attack respect logic willing share thank advance hopefully not continue insult whatever reason choose,0
one feral hoodlum put rest we no long need fear thuggish behavior upset blame parent fail raise right provide proper supervision defective start either way sound like case quality control thank officer wilson job,1
let not news,0
loved crayon martin video love one wish could deliver cable news maybe people would get truth,0
city full really really really dumb people not try reason,1
ever get situation run asshole,1
racist piece shit reach anything justify murder extremely shameful slant fact order justify racist biased view,1
come towards officer thing charge officer person 35 foot away no eyewitness say,0
get shoot time inside right arm palm hand not hand surrender position not consistent charge officer consistent eye witness account say surrender,0
bear mace gas pedal,1
mother fucker fuck peace shit,1
burn public storage make sense,0
believe correct word caucasian not white let we correct every regard great report though love video,0
joe organ idiot,1
watch keep mutter shoot shoot pull trigger rubber bullet hurt like fer,1
wait riot people stand barely sidewalk guy gun middle traffic,0
criminal get shoot great,1
really black people violent,0
huge wisdom anyone ear listen,0
black able white people rush hour traffic come home job bring lazy ass watching get high fuck people provide welfare yea white people sit jury rule po lice brutality shooting piss sure getting see side story,1
people talk stupid subject not care blue purple cousin kill drunk african driver leave die go local news see rioting outside no sorry michael family truly everyone loose someone people get violent people post think people,0
bitch deport,1
thank stefan well put,0
hell even interview guy idiot,1
go pay store owner cigar big gigantic mike stole,0
dumb people,1
not attack police officer steal store expect,0
