Text_clean,Idioma_Tecnica,Texto_Original,IsToxic,IsAbusive,IsThreat,IsProvocative,IsObscene,IsHatespeech,IsRacist,IsNationalist,IsSexist,IsReligiousHate
Croyez la photo douce complice géant donne un signe de gang brun relance redreder peut-être réaliser des troubles de souffle Wilson Adrenaline Run High React Officier Hésitez perdre la vie Lord Know Thug Go College Look Angelic Professional Athlete obtenant une arrestation Crap Feed dégoûté,fr_translation,believe photo gentle giant accomplice give gang sign brown raise hand surrender maybe realize blow trouble officer wilson adrenaline run high react officer hesitate lose life lord know thing thug go college look angelic professional athlete getting arrest crap feed disgusted,1,False,False,False,False,True,True,False,False,False
Glauben Sie Foto sanfter Riese -Komplizen Geben Sie Bandenzeichen Brown Raise Hand Surrender vielleicht erkennen Sie den Blow Trouble Officer Wilson Adrenaline Run High React Officer zögern,de_translation,believe photo gentle giant accomplice give gang sign brown raise hand surrender maybe realize blow trouble officer wilson adrenaline run high react officer hesitate lose life lord know thing thug go college look angelic professional athlete getting arrest crap feed disgusted,1,False,False,False,False,True,True,False,False,False
tell racist cop dumb guy mess cop hate michael brown like holy man right kill confusing,en_original,tell racist cop dumb guy mess cop hate michael brown like holy man right kill confusing,0,False,False,False,False,False,False,False,False,False
"decirle a la policía racista tono de la copia de la policía Michael Brown como el hombre santo, la derecha, mata confusa",es_translation,tell racist cop dumb guy mess cop hate michael brown like holy man right kill confusing,0,False,False,False,False,False,False,False,False,False
Tell le flic raciste Dumb Guy Mess Cop déteste Michael Brown comme le saint homme,fr_translation,tell racist cop dumb guy mess cop hate michael brown like holy man right kill confusing,0,False,False,False,False,False,False,False,False,False
Sagen Sie den rassistischen Polizisten Dumb Guy Mess Cop Hass Michael Brown wie heiliger Mann Recht Töten Sie verwirrend,de_translation,tell racist cop dumb guy mess cop hate michael brown like holy man right kill confusing,0,False,False,False,False,False,False,False,False,False
thank stefan molyneux share logical rational evaluation occurrence incident,en_original,thank stefan molyneux share logical rational evaluation occurrence incident,0,False,False,False,False,False,False,False,False,False
Agradezca el incidente de ocurrencia de evaluación racional de Stefan Molyneux Compartir,es_translation,thank stefan molyneux share logical rational evaluation occurrence incident,0,False,False,False,False,False,False,False,False,False
merci Stefan Molyneux partage l'incident de l'évaluation rationnelle logique,fr_translation,thank stefan molyneux share logical rational evaluation occurrence incident,0,False,False,False,False,False,False,False,False,False
Vielen Dank an Stefan Molyneux teilen logische rationale Bewertung Vorfall Vorfall,de_translation,thank stefan molyneux share logical rational evaluation occurrence incident,0,False,False,False,False,False,False,False,False,False
apparently stefan read matter kansas,en_original,apparently stefan read matter kansas,0,False,False,False,False,False,False,False,False,False
"Aparentemente, Stefan lee Matter Kansas",es_translation,apparently stefan read matter kansas,0,False,False,False,False,False,False,False,False,False
"Apparemment, Stefan a lu Matter Kansas",fr_translation,apparently stefan read matter kansas,0,False,False,False,False,False,False,False,False,False
Anscheinend las Stefan Matter Kansas,de_translation,apparently stefan read matter kansas,0,False,False,False,False,False,False,False,False,False
jerk story skittle arizona ice tea component lean actual promethazine pharmaceutical drug easy street level guy quake antebellum period dreamer negro live beneath need realize well statistic white fair white committ violent crime pls come white savior,en_original,jerk story skittle arizona ice tea component lean actual promethazine pharmaceutical drug easy street level guy quake antebellum period dreamer negro live beneath need realize well statistic white fair white committ violent crime pls come white savior,0,False,False,False,False,False,False,False,False,False
Story Jerk Skittle Arizona COMPONENTE DE TEA ICE ALEGO REAL REAL PROMETHAZINE Farmacéutico Droga fácil de nivel de la calle Quake Antebellum Period Dreamer Negro Live Beneath Necesidad Realización de bien estadística Comité blanco de White White Crime PLS Venga White Salvior,es_translation,jerk story skittle arizona ice tea component lean actual promethazine pharmaceutical drug easy street level guy quake antebellum period dreamer negro live beneath need realize well statistic white fair white committ violent crime pls come white savior,0,False,False,False,False,False,False,False,False,False
Jerk Story Skittle Arizona Ice Tea Component Lean réel Promethazine Pharmaceutical Drug Easy Street Nivel Guy Quake Antebellum Pério Dreamer Negro Live Benef Realion Well Statistic White Fair Comict Crime Violent Pl,fr_translation,jerk story skittle arizona ice tea component lean actual promethazine pharmaceutical drug easy street level guy quake antebellum period dreamer negro live beneath need realize well statistic white fair white committ violent crime pls come white savior,0,False,False,False,False,False,False,False,False,False
Jerk Story Skittle Arizona Eiskomponente Lean tatsächliche Promethazine Pharmazeutische Droge Easy Street Level Guy Quake Antebellum Periode Dreamer Negro lebe darunter braucht es gut statistische weiße faire weiße bot gewalttätige krimin,de_translation,jerk story skittle arizona ice tea component lean actual promethazine pharmaceutical drug easy street level guy quake antebellum period dreamer negro live beneath need realize well statistic white fair white committ violent crime pls come white savior,0,False,False,False,False,False,False,False,False,False
fuck gay ass bald white frenchy nigga go set hisself dang judge criminal conspiracy micheal brown mothafuckin hand air son smart know nigga hand mothafuckin air sign showin innocent tha crime sorry cussin shit internationally recognize indication innocence perpetrator niggas medium plain old fashioned example murder degree officer darren wilson takin life nigga college student niggas kent state protestin asse shoot historic event michael brown shoot dead street takin ferguson protest medium mothafuckas try explain away,en_original,fuck gay ass bald white frenchy nigga go set hisself dang judge criminal conspiracy micheal brown mothafuckin hand air son smart know nigga hand mothafuckin air sign showin innocent tha crime sorry cussin shit internationally recognize indication innocence perpetrator niggas medium plain old fashioned example murder degree officer darren wilson takin life nigga college student niggas kent state protestin asse shoot historic event michael brown shoot dead street takin ferguson protest medium mothafuckas try explain away,1,True,False,False,True,False,False,False,False,False
Fuck Gay Ass Bald White Frenchy Nigga Go Set You Self Dang Juez Conspiración Criminal Conspiración Micheal Brown Mothafuckin Air Son Smart Know Nigga Hand Mothafuckin Air Letrero Mostrar inocente Tha Crime Sentón Cussin Shit Internationalmente Reconocer indicación Innocencia Perpetrador Nigga Nigga Medium Plain Old Fashioned Oficial de grado de asesinato Darren Wilson Takin Life Nigga College Nigga Kent State Niggas Kent State ASSE SOTEM ASSE SOMBRES EJEMPLO DE MATRIMI Dead Street Takin Ferguson Protest Medihafuckas intenta explicar,es_translation,fuck gay ass bald white frenchy nigga go set hisself dang judge criminal conspiracy micheal brown mothafuckin hand air son smart know nigga hand mothafuckin air sign showin innocent tha crime sorry cussin shit internationally recognize indication innocence perpetrator niggas medium plain old fashioned example murder degree officer darren wilson takin life nigga college student niggas kent state protestin asse shoot historic event michael brown shoot dead street takin ferguson protest medium mothafuckas try explain away,1,True,False,False,True,False,False,False,False,False
baise le cul gay chauve blanc françy nigga go set son self dang juge criminel conspiration micheal brun mothafuckin hand son fils smart know nigga hand mothafuckin air signe showin innocent tha crime désolé cussin merde Takin Ferguson Protest Moyen Mothafuckas Essayez d'expliquer,fr_translation,fuck gay ass bald white frenchy nigga go set hisself dang judge criminal conspiracy micheal brown mothafuckin hand air son smart know nigga hand mothafuckin air sign showin innocent tha crime sorry cussin shit internationally recognize indication innocence perpetrator niggas medium plain old fashioned example murder degree officer darren wilson takin life nigga college student niggas kent state protestin asse shoot historic event michael brown shoot dead street takin ferguson protest medium mothafuckas try explain away,1,True,False,False,True,False,False,False,False,False
"ficken schwule ass kahl weiß französisch nigga go set sich selbst danger Richter Strafe Verschwörung Micheal Brown Motafuckin Hand Air Sohn Smart wissen Nigga Handmotafuckin Air Zeichen zeigen unschuldige Kriminalität, sorry cussin scheiße international anerkennt Takin Ferguson Protest Medium motafuckas versuchen zu erklären weg",de_translation,fuck gay ass bald white frenchy nigga go set hisself dang judge criminal conspiracy micheal brown mothafuckin hand air son smart know nigga hand mothafuckin air sign showin innocent tha crime sorry cussin shit internationally recognize indication innocence perpetrator niggas medium plain old fashioned example murder degree officer darren wilson takin life nigga college student niggas kent state protestin asse shoot historic event michael brown shoot dead street takin ferguson protest medium mothafuckas try explain away,1,True,False,False,True,False,False,False,False,False
interview constitution worker catch tape say shot hand,en_original,interview constitution worker catch tape say shot hand,0,False,False,False,False,False,False,False,False,False
Entrevista Captura de la Constitución Captura de la cinta Diga la mano de disparo,es_translation,interview constitution worker catch tape say shot hand,0,False,False,False,False,False,False,False,False,False
entretien de la constitution de la constitution.,fr_translation,interview constitution worker catch tape say shot hand,0,False,False,False,False,False,False,False,False,False
Interview Verfassung Arbeiter Catch Tape Say Shot Hand,de_translation,interview constitution worker catch tape say shot hand,0,False,False,False,False,False,False,False,False,False
go pay store owner cigar big gigantic mike stole,en_original,go pay store owner cigar big gigantic mike stole,0,False,False,False,False,False,False,False,False,False
Ir a pagar al dueño de la tienda cigarro Big Gigantic Mike Stole,es_translation,go pay store owner cigar big gigantic mike stole,0,False,False,False,False,False,False,False,False,False
Allez payer le propriétaire du magasin cigare gros gigantesque Mike Stole,fr_translation,go pay store owner cigar big gigantic mike stole,0,False,False,False,False,False,False,False,False,False
GO Pay Store -Besitzer Zigarre große gigantische Mike gestohlen,de_translation,go pay store owner cigar big gigantic mike stole,0,False,False,False,False,False,False,False,False,False
ireland england riots,en_original,ireland england riots,0,False,False,False,False,False,False,False,False,False
Disturbios de Irlanda Inglaterra,es_translation,ireland england riots,0,False,False,False,False,False,False,False,False,False
Émeutes de l'Irlande en Angleterre,fr_translation,ireland england riots,0,False,False,False,False,False,False,False,False,False
Irland England Unruhen,de_translation,ireland england riots,0,False,False,False,False,False,False,False,False,False
thank right black people go vote democrat year race baiting democrats rally base smh,en_original,thank right black people go vote democrat year race baiting democrats rally base smh,0,False,False,False,False,False,False,False,False,False
Agradezco Right Black People Go Vote Demócrata Año de la carrera Cebo de la base de la base de Rally SMH,es_translation,thank right black people go vote democrat year race baiting democrats rally base smh,0,False,False,False,False,False,False,False,False,False
Merci à droite des Noirs va voter une année démocrate Race Baiting Democrats Rally Base SMH,fr_translation,thank right black people go vote democrat year race baiting democrats rally base smh,0,False,False,False,False,False,False,False,False,False
DANKE RICHTIGE SCHWARZE PEOPLE GO VOTEOR DEMOCRAT JAHR RACE BAITING Democrats Rally Base SMH,de_translation,thank right black people go vote democrat year race baiting democrats rally base smh,0,False,False,False,False,False,False,False,False,False
wow common sense refreshing great job stefan molyneux,en_original,wow common sense refreshing great job stefan molyneux,0,False,False,False,False,False,False,False,False,False
wow sentido común refrescante gran trabajo Stefan Molyneux,es_translation,wow common sense refreshing great job stefan molyneux,0,False,False,False,False,False,False,False,False,False
Wow Common Sense rafraîchissant excellent travail Stefan Molyneux,fr_translation,wow common sense refreshing great job stefan molyneux,0,False,False,False,False,False,False,False,False,False
Wow gesunder Menschenverstand erfrischend tolle Arbeit Stefan Molyneux,de_translation,wow common sense refreshing great job stefan molyneux,0,False,False,False,False,False,False,False,False,False
focus roll blunt cause happen like non criminal type criminal type smoke pot pot absolutely fact walk drive important bring pot relative intel yes criminal tendency smoke pot criminal tend smoke cigarette drink,en_original,focus roll blunt cause happen like non criminal type criminal type smoke pot pot absolutely fact walk drive important bring pot relative intel yes criminal tendency smoke pot criminal tend smoke cigarette drink,0,False,False,False,False,False,False,False,False,False
Focus Roll Blunt Cause sucede como el tipo no criminal Tipo criminal Pot de humo,es_translation,focus roll blunt cause happen like non criminal type criminal type smoke pot pot absolutely fact walk drive important bring pot relative intel yes criminal tendency smoke pot criminal tend smoke cigarette drink,0,False,False,False,False,False,False,False,False,False
La cause émoussée de la concentration se produit comme un pot de type criminel non criminel Pot de fumée Absolument FACT DRADE IMPORT,fr_translation,focus roll blunt cause happen like non criminal type criminal type smoke pot pot absolutely fact walk drive important bring pot relative intel yes criminal tendency smoke pot criminal tend smoke cigarette drink,0,False,False,False,False,False,False,False,False,False
FOCUS ROLL DULCH WAHRSCHAFT WIRD NICHT Kriminelle Art Rauchtopf Absolut Fakten Sie Wege Wichtige Topf Relative Intel Ja Kriminelle Tendenz Rauchkolben -Kriminalität Tendenz Zigarettengetränk,de_translation,focus roll blunt cause happen like non criminal type criminal type smoke pot pot absolutely fact walk drive important bring pot relative intel yes criminal tendency smoke pot criminal tend smoke cigarette drink,0,False,False,False,False,False,False,False,False,False
good opinion definitely deadly force charge assault prior carry gun cause world get crazy thank share know,en_original,good opinion definitely deadly force charge assault prior carry gun cause world get crazy thank share know,0,False,False,False,False,False,False,False,False,False
Buena opinión definitivamente la fuerza mortal de asalto de carga de la fuerza de transporte anterior porque el mundo se vuelve loco gracias compartir saber,es_translation,good opinion definitely deadly force charge assault prior carry gun cause world get crazy thank share know,0,False,False,False,False,False,False,False,False,False
Bonne opinion définitivement mortelle facturer l'assaut antérieur à pistolet de transport parce que le monde devient fou de remerciement,fr_translation,good opinion definitely deadly force charge assault prior carry gun cause world get crazy thank share know,0,False,False,False,False,False,False,False,False,False
Gute Meinung definitiv tödliche Kraftbeschuldigung Körperverletzung Vorher,de_translation,good opinion definitely deadly force charge assault prior carry gun cause world get crazy thank share know,0,False,False,False,False,False,False,False,False,False
wonder twist slavery truth year slavery side bet fox news pay record,en_original,wonder twist slavery truth year slavery side bet fox news pay record,0,False,False,False,False,False,False,False,False,False
Wonder Twist Slavery Verdad Año de la esclavitud Bet Fox News Pay Record,es_translation,wonder twist slavery truth year slavery side bet fox news pay record,0,False,False,False,False,False,False,False,False,False
Wonder Twist Sklaverei Wahrheit Jahr Sklaverei Seite Bet Fox News Pay Record,de_translation,wonder twist slavery truth year slavery side bet fox news pay record,0,False,False,False,False,False,False,False,False,False
wtf,en_original,wtf,0,False,False,False,False,False,False,False,False,False
comment topic video set stefan rap actual beat epic,en_original,comment topic video set stefan rap actual beat epic,0,False,False,False,False,False,False,False,False,False
Comentario Tema Video Set Stefan Rap Real Beat Epic,es_translation,comment topic video set stefan rap actual beat epic,0,False,False,False,False,False,False,False,False,False
Sujet de commentaire Ensemble vidéo Stefan Rap réel beat epic,fr_translation,comment topic video set stefan rap actual beat epic,0,False,False,False,False,False,False,False,False,False
Kommentar Thema Video Set Stefan Rap eigentlich Beat Epic,de_translation,comment topic video set stefan rap actual beat epic,0,False,False,False,False,False,False,False,False,False
far base propaganda,en_original,far base propaganda,1,True,False,True,False,False,False,False,False,False
Propaganda de base lejana,es_translation,far base propaganda,1,True,False,True,False,False,False,False,False,False
Propagande de base lointaine,fr_translation,far base propaganda,1,True,False,True,False,False,False,False,False,False
Ferne Basispropaganda,de_translation,far base propaganda,1,True,False,True,False,False,False,False,False,False
look like brown suicide cop thing,en_original,look like brown suicide cop thing,1,True,False,True,False,False,False,False,False,False
Parece cosa de policía suicida marrón,es_translation,look like brown suicide cop thing,1,True,False,True,False,False,False,False,False,False
ressemble à un truc de flic de suicide brun,fr_translation,look like brown suicide cop thing,1,True,False,True,False,False,False,False,False,False
Sieh aus wie braune Selbstmordpolizeiache,de_translation,look like brown suicide cop thing,1,True,False,True,False,False,False,False,False,False
urban youth handle truth present video,en_original,urban youth handle truth present video,0,False,False,False,False,False,False,False,False,False
Urban Youth Many Video presente de la verdad,es_translation,urban youth handle truth present video,0,False,False,False,False,False,False,False,False,False
Les jeunes urbains gèrent la vérité,fr_translation,urban youth handle truth present video,0,False,False,False,False,False,False,False,False,False
Urban Youth Avitle Treal Viasce Video,de_translation,urban youth handle truth present video,0,False,False,False,False,False,False,False,False,False
reason police need wear recording device time people help ensure truth maintain time imagine officer pov camera situation,en_original,reason police need wear recording device time people help ensure truth maintain time imagine officer pov camera situation,0,False,False,False,False,False,False,False,False,False
razón por la razón La policía necesita usar el tiempo de grabación hora de la gente de la gente ayuda a garantizar que la verdad mantenga el tiempo imaginar la situación de la cámara del oficial POV,es_translation,reason police need wear recording device time people help ensure truth maintain time imagine officer pov camera situation,0,False,False,False,False,False,False,False,False,False
raison pour laquelle la police a besoin d'usure du dispositif d'enregistrement Temps Les gens aident à assurer la vérité de maintenir le temps imaginer la situation de la caméra OFFIER POV,fr_translation,reason police need wear recording device time people help ensure truth maintain time imagine officer pov camera situation,0,False,False,False,False,False,False,False,False,False
"Grund, dass die Polizei Aufzeichnungsvorrichtung Zeit benötigt, um sicherzustellen",de_translation,reason police need wear recording device time people help ensure truth maintain time imagine officer pov camera situation,0,False,False,False,False,False,False,False,False,False
police officer wear camera lapel issue open shut case,en_original,police officer wear camera lapel issue open shut case,0,False,False,False,False,False,False,False,False,False
Oficial de policía Usar el problema de la solapa de la cámara,es_translation,police officer wear camera lapel issue open shut case,0,False,False,False,False,False,False,False,False,False
Les policiers portent un problème de revers de la caméra ouverte de fermeture,fr_translation,police officer wear camera lapel issue open shut case,0,False,False,False,False,False,False,False,False,False
Polizeibeamter tragen Kamera -Revers -Ausgabe Open Shut Case,de_translation,police officer wear camera lapel issue open shut case,0,False,False,False,False,False,False,False,False,False
stefan molyneux rounded view simply want use old tired ploy discredit michael brown sane person believe officer wilson perfect angelic white man person exist privy questionable characteristic cop rest assure human nature spite brown smoking weed steal blunt rap bitch gun etc justify unarmed shoot time desensitized culture hip hop white people monetarily benefit,en_original,stefan molyneux rounded view simply want use old tired ploy discredit michael brown sane person believe officer wilson perfect angelic white man person exist privy questionable characteristic cop rest assure human nature spite brown smoking weed steal blunt rap bitch gun etc justify unarmed shoot time desensitized culture hip hop white people monetarily benefit,0,False,False,False,False,False,False,False,False,False
Stefan Molyneux Vista redondeada Simplemente quiero usar la vieja estratagema cansada Desacredit Michael Brown Sane Persona Beler Oficial Wilson Perfecto Angelic White Persono Existen Privia cuestionable característica COP COMO ASUDAR la naturaleza humana a pesar de que marrón fumar marih,es_translation,stefan molyneux rounded view simply want use old tired ploy discredit michael brown sane person believe officer wilson perfect angelic white man person exist privy questionable characteristic cop rest assure human nature spite brown smoking weed steal blunt rap bitch gun etc justify unarmed shoot time desensitized culture hip hop white people monetarily benefit,0,False,False,False,False,False,False,False,False,False
"Stefan Molyneux Routed View Want Want Use Utiliser Old fatigué Discrédit Michael Brown Saine personne croit officier Wilson Perfect Angelic White Man Person existant Privysitable Caractéristique Cop assure Assure la nature humaine Spit Brown Smoking Weed Weed Blunt Rap Bitch Gun, etc. justifie le temps de prise de vue non armé Culture désensibilisée Hip Hop White People Money",fr_translation,stefan molyneux rounded view simply want use old tired ploy discredit michael brown sane person believe officer wilson perfect angelic white man person exist privy questionable characteristic cop rest assure human nature spite brown smoking weed steal blunt rap bitch gun etc justify unarmed shoot time desensitized culture hip hop white people monetarily benefit,0,False,False,False,False,False,False,False,False,False
Stefan Molyneux gerundete Ansicht möchte einfach einen alten müden Trick diskreditieren Michael Brown Sane Person Glaube Offizier Wilson Perfect Angelic White Man Person Exist,de_translation,stefan molyneux rounded view simply want use old tired ploy discredit michael brown sane person believe officer wilson perfect angelic white man person exist privy questionable characteristic cop rest assure human nature spite brown smoking weed steal blunt rap bitch gun etc justify unarmed shoot time desensitized culture hip hop white people monetarily benefit,0,False,False,False,False,False,False,False,False,False
say minute easily rap duty white kid play btw pretty sure eminem sum white lyric racism,en_original,say minute easily rap duty white kid play btw pretty sure eminem sum white lyric racism,0,False,False,False,False,False,False,False,False,False
"decir minuto fácilmente Rap Duty White Kid Play Por cierto, bastante seguro de Eminem Sum Sum White Lyric Racism",es_translation,say minute easily rap duty white kid play btw pretty sure eminem sum white lyric racism,0,False,False,False,False,False,False,False,False,False
Dites Minute Easy Easy Rap Duty White Kid Play Btw Sure Sure Eminem Sum Sum White Lyric Racism,fr_translation,say minute easily rap duty white kid play btw pretty sure eminem sum white lyric racism,0,False,False,False,False,False,False,False,False,False
