Text_clean,Idioma_Tecnica,Texto_Original,IsToxic,IsAbusive,IsThreat,IsProvocative,IsObscene,IsHatespeech,IsRacist,IsNationalist,IsSexist,IsReligiousHate
dislike white people offended think racism wasn issue anymore think,en_original,dislike white people offended think racism wasn issue anymore think,1,False,False,False,False,True,True,False,False,False
No les gusta que los blancos ofendidos piensen que el racismo ya no era un problema,es_translation,dislike white people offended think racism wasn issue anymore think,1,False,False,False,False,True,True,False,False,False
Je n'aime pas les Blancs offensés la pensée du racisme ne pensait plus,fr_translation,dislike white people offended think racism wasn issue anymore think,1,False,False,False,False,True,True,False,False,False
"Nicht wie weiße Menschen, die beleidigt sind, denken, Rassismus sei kein Problem mehr denken",de_translation,dislike white people offended think racism wasn issue anymore think,1,False,False,False,False,True,True,False,False,False
come black african americans european american white,en_original,come black african americans european american white,0,False,False,False,False,False,False,False,False,False
Venen los afroamericanos negros Europeo Americano Blanco,es_translation,come black african americans european american white,0,False,False,False,False,False,False,False,False,False
Venez les Afro-Américains noirs blancs européens américains,fr_translation,come black african americans european american white,0,False,False,False,False,False,False,False,False,False
kommen schwarze Afroamerikaner europäische amerikanische Weiße,de_translation,come black african americans european american white,0,False,False,False,False,False,False,False,False,False
idiot reporter survey percent black involve follow gang activity shoplift car jack robbery robbery assault teenage pregnancy,en_original,idiot reporter survey percent black involve follow gang activity shoplift car jack robbery robbery assault teenage pregnancy,1,True,False,False,False,True,True,False,False,False
Idiot Reporter Encuesta porcentaje de negro implica seguir la actividad de pandillas Taller Rober Jack Robery Asalto Adolescente Embarazo,es_translation,idiot reporter survey percent black involve follow gang activity shoplift car jack robbery robbery assault teenage pregnancy,1,True,False,False,False,True,True,False,False,False
racism equally worthless metal jacket,en_original,racism equally worthless metal jacket,0,False,False,False,False,False,False,False,False,False
racismo chaqueta de metal sin valor igualmente sin valor,es_translation,racism equally worthless metal jacket,0,False,False,False,False,False,False,False,False,False
Racisme veste en métal tout aussi sans valeur,fr_translation,racism equally worthless metal jacket,0,False,False,False,False,False,False,False,False,False
Rassismus gleichermaßen wertloser Metalljacke,de_translation,racism equally worthless metal jacket,0,False,False,False,False,False,False,False,False,False
testtube explain black stop search white white population search time black population search time pretty obvious white likely search want explain find team actually remember basic grade school math wrong video explain seriously enjoy watch channel bias strong want unsubscribe,en_original,testtube explain black stop search white white population search time black population search time pretty obvious white likely search want explain find team actually remember basic grade school math wrong video explain seriously enjoy watch channel bias strong want unsubscribe,0,False,False,False,False,False,False,False,False,False
Testtube Explicar Black Stop Búsqueda Búsqueda blanca Tiempo de búsqueda de población blanca Tiempo de búsqueda de Black Población bastante obvia Probablemente Búsqueda de búsqueda Despletente Encuentro equipo en realidad Recuerda Basic School Math Video mal Video Explicar gravemente Disfrute de ver al canal Bias Fuerte Describe la suscripción,es_translation,testtube explain black stop search white white population search time black population search time pretty obvious white likely search want explain find team actually remember basic grade school math wrong video explain seriously enjoy watch channel bias strong want unsubscribe,0,False,False,False,False,False,False,False,False,False
Testtube expliquer la recherche en noir stop noir blanc de recherche de population de recherche de population noire de recherche de population de recherche assez évide,fr_translation,testtube explain black stop search white white population search time black population search time pretty obvious white likely search want explain find team actually remember basic grade school math wrong video explain seriously enjoy watch channel bias strong want unsubscribe,0,False,False,False,False,False,False,False,False,False
testTube erklären schwarze Stop -Suche weiße weiße Bevölkerungssuche Zeit Schwarze Bevölkerung Suchzeit Ziemlich offensichtliche weiße Suche nach Erklären Find -Team Tatsächlich erinnern grundlegende Grundschule Mathematik Falsches Video Erklären Sie ernsthaft ansehen.,de_translation,testtube explain black stop search white white population search time black population search time pretty obvious white likely search want explain find team actually remember basic grade school math wrong video explain seriously enjoy watch channel bias strong want unsubscribe,0,False,False,False,False,False,False,False,False,False
majority people ferguson african american elect official african american mayor city council police chief elect official people community step fill role,en_original,majority people ferguson african american elect official african american mayor city council police chief elect official people community step fill role,0,False,False,False,False,False,False,False,False,False
personas mayoritarias Ferguson Electo Electo Oficial de Afroamericano Alcalde Afroamericano Jefe de Policía del Consejo Municipal Electo People Oficial Community Paso de llenado,es_translation,majority people ferguson african american elect official african american mayor city council police chief elect official people community step fill role,0,False,False,False,False,False,False,False,False,False
majorité des gens Ferguson afro-américain élu élu le chef de la police du conseil municipal afro-américain.,fr_translation,majority people ferguson african american elect official african american mayor city council police chief elect official people community step fill role,0,False,False,False,False,False,False,False,False,False
Mehrheit Menschen Ferguson Afroamerikaner Auswahl offizieller afroamerikanischer Bürgermeister der Stadtratspolizistin Wahlbeamter Beamter Volksgemeinde Gemeinschaft Schritt Füllrolle,de_translation,majority people ferguson african american elect official african american mayor city council police chief elect official people community step fill role,0,False,False,False,False,False,False,False,False,False
favorite test tube video far,en_original,favorite test tube video far,0,False,False,False,False,False,False,False,False,False
Video favorito de los tubos de ensayo lejos,es_translation,favorite test tube video far,0,False,False,False,False,False,False,False,False,False
vidéo de tube à essai préféré loin,fr_translation,favorite test tube video far,0,False,False,False,False,False,False,False,False,False
Lieblings -Testrohrvideo weit,de_translation,favorite test tube video far,0,False,False,False,False,False,False,False,False,False
hear billionaire fund organise riot fucken suck joke,en_original,hear billionaire fund organise riot fucken suck joke,1,True,False,False,True,False,False,False,False,False
escuchar el fondo multimillonario organizar riot joder chiste chupa,es_translation,hear billionaire fund organise riot fucken suck joke,1,True,False,False,True,False,False,False,False,False
Écoutez le fonds milliardaire organiser une blague Riot Fucken Suck,fr_translation,hear billionaire fund organise riot fucken suck joke,1,True,False,False,True,False,False,False,False,False
Hören Sie den Milliardärsfond,de_translation,hear billionaire fund organise riot fucken suck joke,1,True,False,False,True,False,False,False,False,False
slow tell speed scully talk quickly great video great information little fast,en_original,slow tell speed scully talk quickly great video great information little fast,0,False,False,False,False,False,False,False,False,False
lento contar velocidad scully hablar rápidamente gran video gran información poco rápido,es_translation,slow tell speed scully talk quickly great video great information little fast,0,False,False,False,False,False,False,False,False,False
Slow Tell Speed ​​Scully parler rapidement super vidéo excellente information peu rapide,fr_translation,slow tell speed scully talk quickly great video great information little fast,0,False,False,False,False,False,False,False,False,False
Slow Tell Speed ​​Scully Talk schnell tolles Video tolle Informationen kleiner schnell schnell,de_translation,slow tell speed scully talk quickly great video great information little fast,0,False,False,False,False,False,False,False,False,False
agree police action kill boy mean protest loot destroy neighbourhood stupid make people want support struggle,en_original,agree police action kill boy mean protest loot destroy neighbourhood stupid make people want support struggle,0,False,False,False,False,False,False,False,False,False
"De acuerdo, la acción de la policía mata al niño malvado botín de protesta destruir el vecindario estúpido haz que la gente quiera la lucha de apoyo",es_translation,agree police action kill boy mean protest loot destroy neighbourhood stupid make people want support struggle,0,False,False,False,False,False,False,False,False,False
Convention de la police Action Kill Boy Moyenne de protestation Loot Détruiser le quartier Stupide Faire des gens à vouloir du soutien à la lutte,fr_translation,agree police action kill boy mean protest loot destroy neighbourhood stupid make people want support struggle,0,False,False,False,False,False,False,False,False,False
Stimmen Sie der Polizei zu. Aktion Kill Boy meine Protest Beute zerstören die Nachbarschaft dumme Menschen wollen Unterstützung für Unterstützungskämpfe,de_translation,agree police action kill boy mean protest loot destroy neighbourhood stupid make people want support struggle,0,False,False,False,False,False,False,False,False,False
fucking savage protest sumthe real like government rob sendin kid elegal war laugh stock america congrat,en_original,fucking savage protest sumthe real like government rob sendin kid elegal war laugh stock america congrat,1,True,False,False,False,False,False,False,False,False
Jodidamente salvaje Sume de protesta de la verdad como el gobierno Rob Sendin Kid Elegal War Laugh Stock America Felicidad,es_translation,fucking savage protest sumthe real like government rob sendin kid elegal war laugh stock america congrat,1,True,False,False,False,False,False,False,False,False
Putain de protestation sauvage Sumhe réel comme le gouvernement Rob Sendin Kid Elegal War Laugh Stock America Félicitations,fr_translation,fucking savage protest sumthe real like government rob sendin kid elegal war laugh stock america congrat,1,True,False,False,False,False,False,False,False,False
verdammter wilder Protestsum der Realität wie der Regierung Rob Sendin Kid Elegal War Laugh Stock Amerika Herzlichen Glückwunsch,de_translation,fucking savage protest sumthe real like government rob sendin kid elegal war laugh stock america congrat,1,True,False,False,False,False,False,False,False,False
come read racist comment lol,en_original,come read racist comment lol,0,False,False,False,False,False,False,False,False,False
Ven a leer comentario racista lol,es_translation,come read racist comment lol,0,False,False,False,False,False,False,False,False,False
Venez lire le commentaire raciste lol,fr_translation,come read racist comment lol,0,False,False,False,False,False,False,False,False,False
Komm und lies rassistische Kommentar lol,de_translation,come read racist comment lol,0,False,False,False,False,False,False,False,False,False
sure people protest actually protest believe people take advantage sad situation cause chaos damage hurt community,en_original,sure people protest actually protest believe people take advantage sad situation cause chaos damage hurt community,0,False,False,False,False,False,False,False,False,False
Seguro que las personas protestan en realidad protesta cree que las personas aprovechan la situación triste porque el caos daño daño a la comunidad,es_translation,sure people protest actually protest believe people take advantage sad situation cause chaos damage hurt community,0,False,False,False,False,False,False,False,False,False
"Bien sûr, les gens protestent en fait à protester croient que les gens profitent de la situation triste, causant aux dommages causés par le chaos.",fr_translation,sure people protest actually protest believe people take advantage sad situation cause chaos damage hurt community,0,False,False,False,False,False,False,False,False,False
"Sicher, Menschen protestieren tatsächlich Protest glauben, dass Menschen eine traurige Situation nutzen, was Chaos Schaden verursacht, die die Gemeinschaft verletzen, die Gemeinschaft verletzen",de_translation,sure people protest actually protest believe people take advantage sad situation cause chaos damage hurt community,0,False,False,False,False,False,False,False,False,False
need come togather,en_original,need come togather,0,False,False,False,False,False,False,False,False,False
Necesito venir,es_translation,need come togather,0,False,False,False,False,False,False,False,False,False
Besoin de venir ensemble,fr_translation,need come togather,0,False,False,False,False,False,False,False,False,False
brauchst Togather,de_translation,need come togather,0,False,False,False,False,False,False,False,False,False
peacefully protest burn car lol,en_original,peacefully protest burn car lol,0,False,False,False,False,False,False,False,False,False
protesta pacíficamente Burn coche lol,es_translation,peacefully protest burn car lol,0,False,False,False,False,False,False,False,False,False
protester paisiblement la voiture de brûlure lol,fr_translation,peacefully protest burn car lol,0,False,False,False,False,False,False,False,False,False
Friedlich protestieren brennern lol lol,de_translation,peacefully protest burn car lol,0,False,False,False,False,False,False,False,False,False
section lady gentleman black people misbehave wonder happen riot court decision way,en_original,section lady gentleman black people misbehave wonder happen riot court decision way,1,False,False,False,False,True,True,False,False,False
Sección Lady Gentleman Black People Madhave Wonder.,es_translation,section lady gentleman black people misbehave wonder happen riot court decision way,1,False,False,False,False,True,True,False,False,False
Section Lady Gentleman Black People se comporter mal se produire,fr_translation,section lady gentleman black people misbehave wonder happen riot court decision way,1,False,False,False,False,True,True,False,False,False
"Sektion Lady Gentleman Schwarze Menschen haben sich schlecht verhalten, wie er auf Riot Court Entscheidung passt",de_translation,section lady gentleman black people misbehave wonder happen riot court decision way,1,False,False,False,False,True,True,False,False,False
dirtbag include cnn,en_original,dirtbag include cnn,1,True,False,False,False,False,False,False,False,False
Dirtbag incluye CNN,es_translation,dirtbag include cnn,1,True,False,False,False,False,False,False,False,False
Dirtbag inclut CNN,fr_translation,dirtbag include cnn,1,True,False,False,False,False,False,False,False,False
Dirtbag gehört CNN,de_translation,dirtbag include cnn,1,True,False,False,False,False,False,False,False,False
protester throw stuff reporter,en_original,protester throw stuff reporter,0,False,False,False,False,False,False,False,False,False
Reportero del manifestante.,es_translation,protester throw stuff reporter,0,False,False,False,False,False,False,False,False,False
Proteter Throw Stump Reporter,fr_translation,protester throw stuff reporter,0,False,False,False,False,False,False,False,False,False
Demonstrant Wurf -Stuff Reporter,de_translation,protester throw stuff reporter,0,False,False,False,False,False,False,False,False,False
guy get hard,en_original,guy get hard,0,False,False,False,False,False,False,False,False,False
chico se pone duro,es_translation,guy get hard,0,False,False,False,False,False,False,False,False,False
Guy devient dur,fr_translation,guy get hard,0,False,False,False,False,False,False,False,False,False
Kerl wird hart,de_translation,guy get hard,0,False,False,False,False,False,False,False,False,False
watch keep mutter shoot shoot pull trigger rubber bullet hurt like mfer,en_original,watch keep mutter shoot shoot pull trigger rubber bullet hurt like mfer,1,True,False,True,False,False,False,False,False,False
Mira Keep Mutter Shoot Shoot Pull gatista Bullet de goma duele como Mfer,es_translation,watch keep mutter shoot shoot pull trigger rubber bullet hurt like mfer,1,True,False,True,False,False,False,False,False,False
Regardez Keep Mutter Shoot Shoot Pull Trigger Rubber Bullet Hurt Like Mfer,fr_translation,watch keep mutter shoot shoot pull trigger rubber bullet hurt like mfer,1,True,False,True,False,False,False,False,False,False
Uhr Keep Mutter Shoot Shooting Pull Trigger Gummi -Kugel verletzt wie Mer,de_translation,watch keep mutter shoot shoot pull trigger rubber bullet hurt like mfer,1,True,False,True,False,False,False,False,False,False
send france,en_original,send france,0,False,False,False,False,False,False,False,False,False
Enviar a Francia,es_translation,send france,0,False,False,False,False,False,False,False,False,False
Envoyer la France,fr_translation,send france,0,False,False,False,False,False,False,False,False,False
Sende Frankreich,de_translation,send france,0,False,False,False,False,False,False,False,False,False
fun fact live ammo gun rubber slug,en_original,fun fact live ammo gun rubber slug,0,False,False,False,False,False,False,False,False,False
Dato divertido en vivo de munición de munición de goma de goma,es_translation,fun fact live ammo gun rubber slug,0,False,False,False,False,False,False,False,False,False
Fait amusant live Mamo Gun Rubber Slug,fr_translation,fun fact live ammo gun rubber slug,0,False,False,False,False,False,False,False,False,False
lustige Fakten Live Munitionswaffen -Gummi Schnecke,de_translation,fun fact live ammo gun rubber slug,0,False,False,False,False,False,False,False,False,False
fucking brain dead let nazi police scum bag,en_original,fucking brain dead let nazi police scum bag,1,True,False,True,False,False,False,False,False,False
Jodidamente muerto cerebral deja la bolsa de escoria de la policía nazi,es_translation,fucking brain dead let nazi police scum bag,1,True,False,True,False,False,False,False,False,False
putain de cerveau mort de laisser la police nazie Sac en écume,fr_translation,fucking brain dead let nazi police scum bag,1,True,False,True,False,False,False,False,False,False
verdammte Gehirn tot lassen,de_translation,fucking brain dead let nazi police scum bag,1,True,False,True,False,False,False,False,False,False
dis furgusun unitid stateth murka retard start violent protest try pawn police state lie cop arrive,en_original,dis furgusun unitid stateth murka retard start violent protest try pawn police state lie cop arrive,1,True,False,True,False,False,False,False,False,False
Dis Furgusun Unitid Stateth Murka Retard Start Protest Violent Prot Ty Paid Police State Lie Cop Llegada,es_translation,dis furgusun unitid stateth murka retard start violent protest try pawn police state lie cop arrive,1,True,False,True,False,False,False,False,False,False
Dis furgusun unitide stateth Murka retard commencer violente protestage essayez le pion policier de l'État de mensonge flic arrive,fr_translation,dis furgusun unitid stateth murka retard start violent protest try pawn police state lie cop arrive,1,True,False,True,False,False,False,False,False,False
Id Furgusun UnitId Stateth Murka Retard Start gewalttätiger Protest Versuchen,de_translation,dis furgusun unitid stateth murka retard start violent protest try pawn police state lie cop arrive,1,True,False,True,False,False,False,False,False,False
god bless police,en_original,god bless police,0,False,False,False,False,False,False,False,False,False
Dios bendiga a la policía,es_translation,god bless police,0,False,False,False,False,False,False,False,False,False
Dieu bénisse la police,fr_translation,god bless police,0,False,False,False,False,False,False,False,False,False
Gott segne die Polizei,de_translation,god bless police,0,False,False,False,False,False,False,False,False,False
usa land free baby hahahaha people live usa thankful everyday bad country earth,en_original,usa land free baby hahahaha people live usa thankful everyday bad country earth,1,False,False,False,False,True,True,True,False,False
USA Land Free Baby Jajhaha People Live USA Agradecido todos los días Bad Country Earth,es_translation,usa land free baby hahahaha people live usa thankful everyday bad country earth,1,False,False,False,False,True,True,True,False,False
USA Land Free Baby Hahahaha People Live USA reconnaissant de tous les jours Bad Country Earth,fr_translation,usa land free baby hahahaha people live usa thankful everyday bad country earth,1,False,False,False,False,True,True,True,False,False
USA Land kostenlos Baby Hahahaha Menschen leben USA dankbar alltäglich schlechtes Land Erde,de_translation,usa land free baby hahahaha people live usa thankful everyday bad country earth,1,False,False,False,False,True,True,True,False,False
virginia,en_original,virginia,0,False,False,False,False,False,False,False,False,False
wow need shit straight weapon point vid ready position riot understandable course action know,en_original,wow need shit straight weapon point vid ready position riot understandable course action know,0,False,False,False,False,False,False,False,False,False
wow necesito mierda de punto de arma recta vid posición lista antidisturbios,es_translation,wow need shit straight weapon point vid ready position riot understandable course action know,0,False,False,False,False,False,False,False,False,False
wow a besoin de merde à arme droite vid position prête émeute,fr_translation,wow need shit straight weapon point vid ready position riot understandable course action know,0,False,False,False,False,False,False,False,False,False
wow brauchst Scheiße Straight Weapon Point Vid Ready Position Aufstand verständlicher Kursaktion wissen wissen,de_translation,wow need shit straight weapon point vid ready position riot understandable course action know,0,False,False,False,False,False,False,False,False,False
dumber people earth american,en_original,dumber people earth american,1,False,False,False,False,True,True,True,False,False
People de más tonta Earth American,es_translation,dumber people earth american,1,False,False,False,False,True,True,True,False,False
dümmer Menschen Erde amerikanisch,de_translation,dumber people earth american,1,False,False,False,False,True,True,True,False,False
screw price crap think cool disrespect american flag,en_original,screw price crap think cool disrespect american flag,1,True,False,False,False,False,False,False,False,False
Mierda de precio del tornillo Piense en una falta de respeto a la bandera estadounidense,es_translation,screw price crap think cool disrespect american flag,1,True,False,False,False,False,False,False,False,False
Prix ​​de vis CRAP Think Cabinet Cool American Flag,fr_translation,screw price crap think cool disrespect american flag,1,True,False,False,False,False,False,False,False,False
Schraubenpreis Mist denken Sie cool Respektlosigkeit amerikanischer Flagge,de_translation,screw price crap think cool disrespect american flag,1,True,False,False,False,False,False,False,False,False
shoot ask question later hahahahahaha,en_original,shoot ask question later hahahahahaha,1,True,False,True,False,False,False,False,False,False
Dispara a hacer preguntas más tarde jajajajaja,es_translation,shoot ask question later hahahahahaha,1,True,False,True,False,False,False,False,False,False
tournez la question posée plus tard hahahahahaha,fr_translation,shoot ask question later hahahahahaha,1,True,False,True,False,False,False,False,False,False
Schießen Sie Fragen später hahahahahaha,de_translation,shoot ask question later hahahahahaha,1,True,False,True,False,False,False,False,False,False
police army,en_original,police army,0,False,False,False,False,False,False,False,False,False
ejército de la policía,es_translation,police army,0,False,False,False,False,False,False,False,False,False
armée de police,fr_translation,police army,0,False,False,False,False,False,False,False,False,False
shoot,en_original,shoot,1,True,False,True,False,False,False,False,False,False
true dictatorship let wait check coutrie start sanction government guess country usa corrupted country world russia china,en_original,true dictatorship let wait check coutrie start sanction government guess country usa corrupted country world russia china,1,True,False,True,False,False,False,False,False,False
verdadera dictadura Let Wait Check Coatrie Inicie Sanción Gobierno Supongo país USA Corrupto país Mundo Rusia China,es_translation,true dictatorship let wait check coutrie start sanction government guess country usa corrupted country world russia china,1,True,False,True,False,False,False,False,False,False
