Text_clean,Idioma_Tecnica,Texto_Original,IsToxic,IsAbusive,IsThreat,IsProvocative,IsObscene,IsHatespeech,IsRacist,IsNationalist,IsSexist,IsReligiousHate
Des trucs comme la raison pour laquelle les gens associent la violence danger les noirs,fr_translation,stuff like reason people associate violence danger black people,1,False,False,False,False,True,True,False,False,False
"Sachen wie Grund, warum Menschen Gewalt Gefahren in Verbindung bringen, schwarze Menschen",de_translation,stuff like reason people associate violence danger black people,1,False,False,False,False,True,True,False,False,False
awesome,en_original,awesome,0,False,False,False,False,False,False,False,False,False
love lady need strong woman like peggy hubbard,en_original,love lady need strong woman like peggy hubbard,0,False,False,False,False,False,False,False,False,False
Lady Love necesita mujer fuerte como Peggy Hubbard,es_translation,love lady need strong woman like peggy hubbard,0,False,False,False,False,False,False,False,False,False
Love Lady a besoin d'une femme forte comme Peggy Hubbard,fr_translation,love lady need strong woman like peggy hubbard,0,False,False,False,False,False,False,False,False,False
Liebe Dame braucht eine starke Frau wie Peggy Hubbard,de_translation,love lady need strong woman like peggy hubbard,0,False,False,False,False,False,False,False,False,False
peggy native american love honey,en_original,peggy native american love honey,0,False,False,False,False,False,False,False,False,False
Peggy nativo americano amor cariño,es_translation,peggy native american love honey,0,False,False,False,False,False,False,False,False,False
Peggy amérindien amour miel,fr_translation,peggy native american love honey,0,False,False,False,False,False,False,False,False,False
Peggy Ureinwohner Amerikaner Liebe Honig,de_translation,peggy native american love honey,0,False,False,False,False,False,False,False,False,False
huge wisdom ear listen,en_original,huge wisdom ear listen,0,False,False,False,False,False,False,False,False,False
Enorme sabiduría oído escuchar,es_translation,huge wisdom ear listen,0,False,False,False,False,False,False,False,False,False
Énorme écoute de l'oreille de sagesse,fr_translation,huge wisdom ear listen,0,False,False,False,False,False,False,False,False,False
riesiges Weisheitsohr hören zu,de_translation,huge wisdom ear listen,0,False,False,False,False,False,False,False,False,False
mrs hubbard jamyla bolden die needlessly,en_original,mrs hubbard jamyla bolden die needlessly,0,False,False,False,False,False,False,False,False,False
La Sra. Hubbard Jamyla Bolden muere innecesariamente,es_translation,mrs hubbard jamyla bolden die needlessly,0,False,False,False,False,False,False,False,False,False
Mme Hubbard Jamyla Bolden Die inutilement,fr_translation,mrs hubbard jamyla bolden die needlessly,0,False,False,False,False,False,False,False,False,False
Frau Hubbard Jamyla Bolden stirbt unnötig,de_translation,mrs hubbard jamyla bolden die needlessly,0,False,False,False,False,False,False,False,False,False
amen amen sister strong black woman get,en_original,amen amen sister strong black woman get,0,False,False,False,False,False,False,False,False,False
Amén Amén Hermana Strong Black Woman Get,es_translation,amen amen sister strong black woman get,0,False,False,False,False,False,False,False,False,False
amen amen sœur forte femme noire,fr_translation,amen amen sister strong black woman get,0,False,False,False,False,False,False,False,False,False
Amen Amen Schwester Strong Black Woman bekommt,de_translation,amen amen sister strong black woman get,0,False,False,False,False,False,False,False,False,False
stand woman speak truth applaud gut young lady,en_original,stand woman speak truth applaud gut young lady,0,False,False,False,False,False,False,False,False,False
Mujer de pie habla verdad aplaudir a la joven dama,es_translation,stand woman speak truth applaud gut young lady,0,False,False,False,False,False,False,False,False,False
stand femme dit la vérité applaudir la jeune femme,fr_translation,stand woman speak truth applaud gut young lady,0,False,False,False,False,False,False,False,False,False
Stand Frau spreche Wahrheit begrüßt die junge Dame,de_translation,stand woman speak truth applaud gut young lady,0,False,False,False,False,False,False,False,False,False
peggy bless courage heart thank honesty passion matter,en_original,peggy bless courage heart thank honesty passion matter,0,False,False,False,False,False,False,False,False,False
Peggy bendiga coraje corazón gracias honesty pasión materia,es_translation,peggy bless courage heart thank honesty passion matter,0,False,False,False,False,False,False,False,False,False
Peggy Bless Courage Heart merci d'honnêteté Passion Matter,fr_translation,peggy bless courage heart thank honesty passion matter,0,False,False,False,False,False,False,False,False,False
Peggy segne Mut Herz danke Ehrlichkeit Leidenschaft Materie,de_translation,peggy bless courage heart thank honesty passion matter,0,False,False,False,False,False,False,False,False,False
lady guest speaker sharpton rally seriously,en_original,lady guest speaker sharpton rally seriously,0,False,False,False,False,False,False,False,False,False
Patante invitada de Lady Sharpton Rally en serio,es_translation,lady guest speaker sharpton rally seriously,0,False,False,False,False,False,False,False,False,False
Le conférencier invité Sharpton rallye sérieusement,fr_translation,lady guest speaker sharpton rally seriously,0,False,False,False,False,False,False,False,False,False
Lady Gastredner Sharpton Rally ernsthaft,de_translation,lady guest speaker sharpton rally seriously,0,False,False,False,False,False,False,False,False,False
love woman voice matter fuck black life matter,en_original,love woman voice matter fuck black life matter,1,True,False,False,False,False,False,False,False,False
Amor mujer voz joder la vida negra materia,es_translation,love woman voice matter fuck black life matter,1,True,False,False,False,False,False,False,False,False
amour femme voix matière baise la vie noire,fr_translation,love woman voice matter fuck black life matter,1,True,False,False,False,False,False,False,False,False
Liebe Frau Stimme Materie ficken schwarze Leben Materie,de_translation,love woman voice matter fuck black life matter,1,True,False,False,False,False,False,False,False,False
real parent real mother real talk right learn mom voice truth sea bullshit,en_original,real parent real mother real talk right learn mom voice truth sea bullshit,0,False,False,False,False,False,False,False,False,False
Padre real Madre real Talk Real Derecho Aprendiendo Mom Voz Verdad Sea Mierda,es_translation,real parent real mother real talk right learn mom voice truth sea bullshit,0,False,False,False,False,False,False,False,False,False
vrai parent vraie mère vrai parler bien apprendre la voix maman vérité conneries de mer,fr_translation,real parent real mother real talk right learn mom voice truth sea bullshit,0,False,False,False,False,False,False,False,False,False
echte Eltern echte Mutter Real Talk Richtig lernen Mutter Stimme Wahrheit Sea Bullshit,de_translation,real parent real mother real talk right learn mom voice truth sea bullshit,0,False,False,False,False,False,False,False,False,False
finally black person unbiased opinion incredibly high percentage black life lose extremely small fraction police black people need responsibility violence,en_original,finally black person unbiased opinion incredibly high percentage black life lose extremely small fraction police black people need responsibility violence,1,False,False,False,False,True,True,False,False,False
"Finalmente, la Opinión de la Persona Negra es una opinión imparcial increíblemente alto, la vida negra pierde una fracción extremadamente pequeña que la policía necesita la responsabilidad de la violencia de la responsabilidad",es_translation,finally black person unbiased opinion incredibly high percentage black life lose extremely small fraction police black people need responsibility violence,1,False,False,False,False,True,True,False,False,False
"Enfin, une personne noire opinion impartiale pour pourcentage incroyablement élevé La vie noire perd la police extrême",fr_translation,finally black person unbiased opinion incredibly high percentage black life lose extremely small fraction police black people need responsibility violence,1,False,False,False,False,True,True,False,False,False
Endlich schwarze Person unvoreingenommene Meinung unglaublich hoher Prozentsatz Schwarzes Leben verliert extrem kleine Fraktion Polizei Schwarze Menschen brauchen Verantwortung Gewalt,de_translation,finally black person unbiased opinion incredibly high percentage black life lose extremely small fraction police black people need responsibility violence,1,False,False,False,False,True,True,False,False,False
thank truth speak innocent,en_original,thank truth speak innocent,0,False,False,False,False,False,False,False,False,False
gracias a la verdad hablar inocente,es_translation,thank truth speak innocent,0,False,False,False,False,False,False,False,False,False
"Dieu merci, dit innocent",fr_translation,thank truth speak innocent,0,False,False,False,False,False,False,False,False,False
Danke Wahrheit sprechen unschuldig,de_translation,thank truth speak innocent,0,False,False,False,False,False,False,False,False,False
sad disgrace black people,en_original,sad disgrace black people,1,True,False,False,False,False,False,False,False,False
triste desgracia gente negra,es_translation,sad disgrace black people,1,True,False,False,False,False,False,False,False,False
triste honte des Noirs,fr_translation,sad disgrace black people,1,True,False,False,False,False,False,False,False,False
traurige Schande schwarze Menschen,de_translation,sad disgrace black people,1,True,False,False,False,False,False,False,False,False
mother tell thing god bless woman,en_original,mother tell thing god bless woman,0,False,False,False,False,False,False,False,False,False
Madre diga que Dios bendiga a la mujer,es_translation,mother tell thing god bless woman,0,False,False,False,False,False,False,False,False,False
Mère dire chose que Dieu bénisse la femme,fr_translation,mother tell thing god bless woman,0,False,False,False,False,False,False,False,False,False
"Mutter Erzählen Sie Sache, Gott segne Frau",de_translation,mother tell thing god bless woman,0,False,False,False,False,False,False,False,False,False
gal call spot way peggy way,en_original,gal call spot way peggy way,0,False,False,False,False,False,False,False,False,False
Gal rufen Sie Spot Way Peggy Way an,de_translation,gal call spot way peggy way,0,False,False,False,False,False,False,False,False,False
blk life matter bullshit witch bullshit black people kill period newark bullshitb,en_original,blk life matter bullshit witch bullshit black people kill period newark bullshitb,1,True,False,True,True,False,False,False,False,False
BLK Life Matirbia Bitura Bullshit People Black Period Newark Bullshitb,es_translation,blk life matter bullshit witch bullshit black people kill period newark bullshitb,1,True,False,True,True,False,False,False,False,False
Blk Life Matter Bullshit Witch Bullshit Black People Killing période Newark Bullshitb,fr_translation,blk life matter bullshit witch bullshit black people kill period newark bullshitb,1,True,False,True,True,False,False,False,False,False
Blk Life Matter Bullshit Hexe Bullshit Schwarze Menschen Töten Sie die Periode Newark Bullshitb,de_translation,blk life matter bullshit witch bullshit black people kill period newark bullshitb,1,True,False,True,True,False,False,False,False,False
love saem thing peggy kill self quick stlpd,en_original,love saem thing peggy kill self quick stlpd,0,False,False,False,False,False,False,False,False,False
aime la chose same peggy kill self rapide stlpd,fr_translation,love saem thing peggy kill self quick stlpd,0,False,False,False,False,False,False,False,False,False
Liebe Saem Ding Peggy tötet sich selbst schnell STLPD,de_translation,love saem thing peggy kill self quick stlpd,0,False,False,False,False,False,False,False,False,False
niggas love victim situation separate black people need,en_original,niggas love victim situation separate black people need,1,False,False,False,False,True,True,False,False,False
Situación de víctimas de amor niggas que los negros separados necesitan,es_translation,niggas love victim situation separate black people need,1,False,False,False,False,True,True,False,False,False
les niggas aiment la situation de victime séparés les noirs ont besoin,fr_translation,niggas love victim situation separate black people need,1,False,False,False,False,True,True,False,False,False
Niggas lieben Opfer Situation getrennt Schwarze Menschen brauchen,de_translation,niggas love victim situation separate black people need,1,False,False,False,False,True,True,False,False,False
politician style oratory peggy hubbard short video ring message loud clear listen england thankfully gun culture see american scene time know peggy drop hang wringing crap tell word write post white house mavbe listen act,en_original,politician style oratory peggy hubbard short video ring message loud clear listen england thankfully gun culture see american scene time know peggy drop hang wringing crap tell word write post white house mavbe listen act,0,False,False,False,False,False,False,False,False,False
Estilo político Oratorio Peggy Hubbard Video corto Ring Mensaje HUCHO Claro Escuchar Inglaterra Afortunadamente Cultura de armas ver la escena estadounidense Tiempo Know Peggy Drop Hang Wringing Crap Tell Word Escribir Post de la Casa Blanca Mavbe Escuchar Acto,es_translation,politician style oratory peggy hubbard short video ring message loud clear listen england thankfully gun culture see american scene time know peggy drop hang wringing crap tell word write post white house mavbe listen act,0,False,False,False,False,False,False,False,False,False
share woman awesome,en_original,share woman awesome,0,False,False,False,False,False,False,False,False,False
Compartir mujer impresionante,es_translation,share woman awesome,0,False,False,False,False,False,False,False,False,False
partager une femme géniale,fr_translation,share woman awesome,0,False,False,False,False,False,False,False,False,False
Teile Frau großartig,de_translation,share woman awesome,0,False,False,False,False,False,False,False,False,False
real black leadership real revolutionary radicalism,en_original,real black leadership real revolutionary radicalism,0,False,False,False,False,False,False,False,False,False
Liderazgo negro real Radicalismo revolucionario real,es_translation,real black leadership real revolutionary radicalism,0,False,False,False,False,False,False,False,False,False
vrai leadership noir radicalisme révolutionnaire réel,fr_translation,real black leadership real revolutionary radicalism,0,False,False,False,False,False,False,False,False,False
echte schwarze Führung echter revolutionärer Radikalismus,de_translation,real black leadership real revolutionary radicalism,0,False,False,False,False,False,False,False,False,False
respect,en_original,respect,0,False,False,False,False,False,False,False,False,False
thank voice sanity black community peggy,en_original,thank voice sanity black community peggy,0,False,False,False,False,False,False,False,False,False
Gracias Voice Sanity Black Community Peggy,es_translation,thank voice sanity black community peggy,0,False,False,False,False,False,False,False,False,False
Merci à la voix de Sanity Black Communauté Peggy,fr_translation,thank voice sanity black community peggy,0,False,False,False,False,False,False,False,False,False
Dank der Stimme der Sprache Schwarze Community Peggy,de_translation,thank voice sanity black community peggy,0,False,False,False,False,False,False,False,False,False
wow people like thing rightly say police offend tag racist truth speak give credence society know speak truth magnifie like elevate people like school board city council mayor state national office,en_original,wow people like thing rightly say police offend tag racist truth speak give credence society know speak truth magnifie like elevate people like school board city council mayor state national office,0,False,False,False,False,False,False,False,False,False
wow a la gente como lo correcto dice que la policía ofende la verdad racista hablar dale credence a la sociedad saber hablar verdad magnifie como elevar a personas como la junta escolar municipal al alcalde de la oficina nacional,es_translation,wow people like thing rightly say police offend tag racist truth speak give credence society know speak truth magnifie like elevate people like school board city council mayor state national office,0,False,False,False,False,False,False,False,False,False
wow les gens comme la chose disent à juste titre offenser la police tag la vérité raciste dire donne la société de créance savoir dire la vérité magnifiée comme élever des gens comme le conseil municipal du conseil municipal du conseil municipal du conseil national national,fr_translation,wow people like thing rightly say police offend tag racist truth speak give credence society know speak truth magnifie like elevate people like school board city council mayor state national office,0,False,False,False,False,False,False,False,False,False
"wow Leute wie Sache sagen zu Recht, dass Polizei beleidige Tag rassistische Wahrheit Speak Geben Sie die Glaubwürdigkeit. Wissen Sie.",de_translation,wow people like thing rightly say police offend tag racist truth speak give credence society know speak truth magnifie like elevate people like school board city council mayor state national office,0,False,False,False,False,False,False,False,False,False
navy vet mad respect,en_original,navy vet mad respect,0,False,False,False,False,False,False,False,False,False
veterinario marina respeto loco,es_translation,navy vet mad respect,0,False,False,False,False,False,False,False,False,False
Navy Vet Mad Respekt,de_translation,navy vet mad respect,0,False,False,False,False,False,False,False,False,False
day day thisisacommentary truth,en_original,day day thisisacommentary truth,0,False,False,False,False,False,False,False,False,False
día día esta verdadisacomentaria verdad,es_translation,day day thisisacommentary truth,0,False,False,False,False,False,False,False,False,False
jour de jour cette vérité,fr_translation,day day thisisacommentary truth,0,False,False,False,False,False,False,False,False,False
Tag Tag Thisisacmentary Wahrheit,de_translation,day day thisisacommentary truth,0,False,False,False,False,False,False,False,False,False
bitch talk people like dylan roof james holmes jar loughner jerad miller tim mcveigh jared loughner jim david adkisson paul hill scott roeder frazier glen miller elliot rodger buford furrow john houser etc right,en_original,bitch talk people like dylan roof james holmes jar loughner jerad miller tim mcveigh jared loughner jim david adkisson paul hill scott roeder frazier glen miller elliot rodger buford furrow john houser etc right,1,True,False,False,False,False,False,False,False,False
Bitch habla gente como Dylan Roof James Holmes Jar Loughner Jerad Miller Tim McVeigh Jared Loughner Jim David Adkisson Paul Hill Scott Roeder Frazier Glen Miller Elliot Rodger Buford Furrow John Houser Etc Right Right,es_translation,bitch talk people like dylan roof james holmes jar loughner jerad miller tim mcveigh jared loughner jim david adkisson paul hill scott roeder frazier glen miller elliot rodger buford furrow john houser etc right,1,True,False,False,False,False,False,False,False,False
"salope parle les gens comme Dylan Roof James Holmes Jar Loughner Jerad Miller Tim McVeigh Jared Loughner Jim David Adkisson Paul Hill Scott Roeder Frazier Glen Miller Elliot Rodger Buford Furrow John Houser, etc.",fr_translation,bitch talk people like dylan roof james holmes jar loughner jerad miller tim mcveigh jared loughner jim david adkisson paul hill scott roeder frazier glen miller elliot rodger buford furrow john houser etc right,1,True,False,False,False,False,False,False,False,False
Hündin Talk Leute wie Dylan Dach James Holmes Jar Loughner Jerad Miller Tim McVeigh Jared Loughner Jim David Adkisson Paul Hill Scott Roeder Frazier Glen Miller Elliot Rodger Bufford Furrow John Houser usw.,de_translation,bitch talk people like dylan roof james holmes jar loughner jerad miller tim mcveigh jared loughner jim david adkisson paul hill scott roeder frazier glen miller elliot rodger buford furrow john houser etc right,1,True,False,False,False,False,False,False,False,False
thank real hear little girl think thing rage medium want promote racial tension black community want talk elephant room like medium music scene promote thug life,en_original,thank real hear little girl think thing rage medium want promote racial tension black community want talk elephant room like medium music scene promote thug life,0,False,False,False,False,False,False,False,False,False
Gracias real oye a la niña pensar que la rabia de la rabia quiere promover tensión racial comunidad negra quiero hablar de elefante como escena musical mediana promocionar la vida de los matones,es_translation,thank real hear little girl think thing rage medium want promote racial tension black community want talk elephant room like medium music scene promote thug life,0,False,False,False,False,False,False,False,False,False
merci vraiment entendre la petite fille penser que je rage le médium vouloir promouvoir la tension raciale communauté noire vouloir parler d'éléphant comme la scène musicale médiane promouvoir la vie Thug,fr_translation,thank real hear little girl think thing rage medium want promote racial tension black community want talk elephant room like medium music scene promote thug life,0,False,False,False,False,False,False,False,False,False
Danke Real Hear Little Girl Thinking Ding Rage Medium will rassistische Spannung schwarze Gemeinschaft wollen.,de_translation,thank real hear little girl think thing rage medium want promote racial tension black community want talk elephant room like medium music scene promote thug life,0,False,False,False,False,False,False,False,False,False
peggy hero,en_original,peggy hero,0,False,False,False,False,False,False,False,False,False
héroe de Peggy,es_translation,peggy hero,0,False,False,False,False,False,False,False,False,False
héros de peggy,fr_translation,peggy hero,0,False,False,False,False,False,False,False,False,False
awesome woman,en_original,awesome woman,0,False,False,False,False,False,False,False,False,False
Mujer impresionante,es_translation,awesome woman,0,False,False,False,False,False,False,False,False,False
femme géniale,fr_translation,awesome woman,0,False,False,False,False,False,False,False,False,False
tolle Frau,de_translation,awesome woman,0,False,False,False,False,False,False,False,False,False
think alot black people tired gun violence gang ignorance community want stop yes bad people race get statement talk thing black commuity people quick bad people race put black want people well care selfs repectful way,en_original,think alot black people tired gun violence gang ignorance community want stop yes bad people race get statement talk thing black commuity people quick bad people race put black want people well care selfs repectful way,0,False,False,False,False,False,False,False,False,False
think alot black people tired gun violence gang ignorance community want stop yes bad people race get statement talk thing black commuity people quick poor people race put black want people well care selfs repectful way,en_synonym,think alot black people tired gun violence gang ignorance community want stop yes bad people race get statement talk thing black commuity people quick bad people race put black want people well care selfs repectful way,0,False,False,False,False,False,False,False,False,False
Piense que muchos negros se cansan de la pandilla de la armada Ignorancia de la pandilla Quiera parar Sí People mala Race Obtenga la declaración Talk Thing Black Commuity People Rápica People Race Poner negro Quera el cuidado de la gente de cuidado de la gente,es_translation,think alot black people tired gun violence gang ignorance community want stop yes bad people race get statement talk thing black commuity people quick bad people race put black want people well care selfs repectful way,0,False,False,False,False,False,False,False,False,False
Pensez que beaucoup de Noirs fatigués la communauté d'ignorance des gangs de violence armée veulent s'arrêter oui les mauvaises personnes race Obtenez la déclaration de déclaration chose noire les gens rapides de mauvaises personnes race noire que les gens se soucient bien de soi,fr_translation,think alot black people tired gun violence gang ignorance community want stop yes bad people race get statement talk thing black commuity people quick bad people race put black want people well care selfs repectful way,0,False,False,False,False,False,False,False,False,False
tip hat class lady speak,en_original,tip hat class lady speak,0,False,False,False,False,False,False,False,False,False
TIP HAT HAT CLASE LADY Speak,es_translation,tip hat class lady speak,0,False,False,False,False,False,False,False,False,False
Tipp Hat Class Lady sprechen,de_translation,tip hat class lady speak,0,False,False,False,False,False,False,False,False,False
black people like,en_original,black people like,0,False,False,False,False,False,False,False,False,False
A los negros les gusta,es_translation,black people like,0,False,False,False,False,False,False,False,False,False
Les Noirs aiment,fr_translation,black people like,0,False,False,False,False,False,False,False,False,False
Schwarze mögen,de_translation,black people like,0,False,False,False,False,False,False,False,False,False
