Text_clean,Idioma_Tecnica,Texto_Original,IsToxic,IsAbusive,IsThreat,IsProvocative,IsObscene,IsHatespeech,IsRacist,IsNationalist,IsSexist,IsReligiousHate
people step case wasn people situation lump mess matter hand make kind protest selfish rational thought investigation guy video heavily emotional hype want hear get hear press reasonable discussion kudo smerconish keep level time let masri fool dare tear city protest dishonor entire incident hate way police brutality epidemic wish stop pretend like know exactly go measurable people honestly witness incident clue way issue swing grand jury informed trust majority rule right course action let thank police officer america actually serve protect bit jerk pull respect job know people go pout hold accountable action people hate police need officer emergency,en_original,people step case wasn people situation lump mess matter hand make kind protest selfish rational thought investigation guy video heavily emotional hype want hear get hear press reasonable discussion kudo smerconish keep level time let masri fool dare tear city protest dishonor entire incident hate way police brutality epidemic wish stop pretend like know exactly go measurable people honestly witness incident clue way issue swing grand jury informed trust majority rule right course action let thank police officer america actually serve protect bit jerk pull respect job know people go pout hold accountable action people hate police need officer emergency,0,False,False,False,False,False,False,False,False,False
La gente pasa el caso no era la situación de la gente Mess Matter Matter Haz amable protesta de la investigación egoísta de pensamiento racional Video Video muy emocional Quera escuchar ¿Escuchar escear Discusión razonable Discusión Kudo Smerconish Mantenga el Tiempo de nivel Manténgase de Masri Dare Tear City Dishonor Incidente completo Incidente de Odio Police Brutalidad Espedemia Deseo de detener la Falta de Detente de la Policía de la Policía de la Policía de la Policía de la Policía de la Policía de la Policía. El trabajo sabe que la gente se pone de acuerdo con las acciones responsables de la gente odia a la policía de la policía emergencia,es_translation,people step case wasn people situation lump mess matter hand make kind protest selfish rational thought investigation guy video heavily emotional hype want hear get hear press reasonable discussion kudo smerconish keep level time let masri fool dare tear city protest dishonor entire incident hate way police brutality epidemic wish stop pretend like know exactly go measurable people honestly witness incident clue way issue swing grand jury informed trust majority rule right course action let thank police officer america actually serve protect bit jerk pull respect job know people go pout hold accountable action people hate police need officer emergency,0,False,False,False,False,False,False,False,False,False
"Les personnes étapes de l'étape n'étaient pas les gens situation en morceaux mess Match Match Hakes Gatin Protestation Ségissièrement rationnel Enquête Guy Vidéo Forairement émotionnel Hype Want Entendre GET ENVER PRESS jerk tire respect job sache les gens vont mouiller tenir des mesures responsables, les gens détestent la police besoin d'officier urgence",fr_translation,people step case wasn people situation lump mess matter hand make kind protest selfish rational thought investigation guy video heavily emotional hype want hear get hear press reasonable discussion kudo smerconish keep level time let masri fool dare tear city protest dishonor entire incident hate way police brutality epidemic wish stop pretend like know exactly go measurable people honestly witness incident clue way issue swing grand jury informed trust majority rule right course action let thank police officer america actually serve protect bit jerk pull respect job know people go pout hold accountable action people hate police need officer emergency,0,False,False,False,False,False,False,False,False,False
law enforcement train shoot apprehend train shoot kill thank wilson kill punk bitch,en_original,law enforcement train shoot apprehend train shoot kill thank wilson kill punk bitch,1,True,False,False,False,False,False,False,False,False
"Sesga de trenes de la ley Trawend Train Shoot Kill, gracias a Wilson Kill Punk Bitch",es_translation,law enforcement train shoot apprehend train shoot kill thank wilson kill punk bitch,1,True,False,False,False,False,False,False,False,False
Le tournage du train d'application de la loi appréhende le tournage du train tuer merci wilson tuer punk bitch,fr_translation,law enforcement train shoot apprehend train shoot kill thank wilson kill punk bitch,1,True,False,False,False,False,False,False,False,False
Strafverfolgung Zug Dreh Shooting Zug Shoot Tötung Danke Wilson Kill Punk Schlampe,de_translation,law enforcement train shoot apprehend train shoot kill thank wilson kill punk bitch,1,True,False,False,False,False,False,False,False,False
reckon black life matter banner hold white cunt kinda patronizing ironically racist come somethin well white folk self pride ooo look nice black people race actually world pussyfootin fear racist fuckin daft man,en_original,reckon black life matter banner hold white cunt kinda patronizing ironically racist come somethin well white folk self pride ooo look nice black people race actually world pussyfootin fear racist fuckin daft man,1,True,False,False,True,False,False,False,False,False
"Reckon Black Life Matter Banner sostenga el coño blanco un poco condescendiente irónicamente racista vengo bien, bien blanco, folk auto orgullo ooo se vean bonitas carreras negras en realidad pussyfootin miedo racista",es_translation,reckon black life matter banner hold white cunt kinda patronizing ironically racist come somethin well white folk self pride ooo look nice black people race actually world pussyfootin fear racist fuckin daft man,1,True,False,False,True,False,False,False,False,False
Reckon Black Life Matter Banner Host White Cunt un peu condescendant ironiquement raciste Come Somethin bien blanc Folk Self Pride Ooo Look Nice People Black Race en fait le monde Pussyfootin Fear Racist Fuckin Daft Man,fr_translation,reckon black life matter banner hold white cunt kinda patronizing ironically racist come somethin well white folk self pride ooo look nice black people race actually world pussyfootin fear racist fuckin daft man,1,True,False,False,True,False,False,False,False,False
"reckon schwarzes Leben Materie Banner Halten Sie die weiße Fotze, die ironisch rassistisch kommen und etwas gut weiße Volksfleisch selbst Stolz aussehen.",de_translation,reckon black life matter banner hold white cunt kinda patronizing ironically racist come somethin well white folk self pride ooo look nice black people race actually world pussyfootin fear racist fuckin daft man,1,True,False,False,True,False,False,False,False,False
large number people like police officer call criminal reason police officer fact criminal like police officer testament good work police officer protect public child family danger hessitate help police time people stop complain start police respect hard work dedication require life line serve public,en_original,large number people like police officer call criminal reason police officer fact criminal like police officer testament good work police officer protect public child family danger hessitate help police time people stop complain start police respect hard work dedication require life line serve public,0,False,False,False,False,False,False,False,False,False
Gran número de personas como el oficial de policía llaman a la razón penal del oficial de policía.,es_translation,large number people like police officer call criminal reason police officer fact criminal like police officer testament good work police officer protect public child family danger hessitate help police time people stop complain start police respect hard work dedication require life line serve public,0,False,False,False,False,False,False,False,False,False
un grand nombre de personnes comme un policier appellent la raison pénale du policier de la police de police comme un officier de police Testament Good Work Officier de police Protéger le danger de la famille de la famille des enfants publics Hessitit,fr_translation,large number people like police officer call criminal reason police officer fact criminal like police officer testament good work police officer protect public child family danger hessitate help police time people stop complain start police respect hard work dedication require life line serve public,0,False,False,False,False,False,False,False,False,False
"große Anzahl Personen wie Polizisten rufen kriminelle Gründe an, die Polizist Fakten Kriminelle wie Polizisten Testament gute Arbeit Polizeibeamter schützen öffentliche Kinderfamilie Gefahr Hessitate Hilfseitigen Zeiten, die Menschen aufhören, sich zu beschweren.",de_translation,large number people like police officer call criminal reason police officer fact criminal like police officer testament good work police officer protect public child family danger hessitate help police time people stop complain start police respect hard work dedication require life line serve public,0,False,False,False,False,False,False,False,False,False
arab dude absolutely right shoot extra time shoot attack stop attack shoot twice attack time shoot kill opinion,en_original,arab dude absolutely right shoot extra time shoot attack stop attack shoot twice attack time shoot kill opinion,0,False,False,False,False,False,False,False,False,False
Dude árabe absolutamente correcto disparar tiempo extra dispare ataque de ataque de ataque disparar dos veces el tiempo de ataque de ataque matar opinión,es_translation,arab dude absolutely right shoot extra time shoot attack stop attack shoot twice attack time shoot kill opinion,0,False,False,False,False,False,False,False,False,False
Dec arabe absolument droit tir supplémentaire supplémentaire de tir de tir à coup d'attaque Stop Attack Shoot Twice Time Time Shoot Kill Opinion,fr_translation,arab dude absolutely right shoot extra time shoot attack stop attack shoot twice attack time shoot kill opinion,0,False,False,False,False,False,False,False,False,False
Araber Typ absolut rechts Schießen Sie zusätzliche Zeit Dreh Angriff Stop Attack Shoot Toppy Attack Time Shoot Till Meinungen,de_translation,arab dude absolutely right shoot extra time shoot attack stop attack shoot twice attack time shoot kill opinion,0,False,False,False,False,False,False,False,False,False
people facebook tie isis terrorist group muslim extremist,en_original,people facebook tie isis terrorist group muslim extremist,1,False,False,False,False,True,False,False,False,True
Les gens Facebook attachent l'extrémiste musulman terroriste de Facebook,fr_translation,people facebook tie isis terrorist group muslim extremist,1,False,False,False,False,True,False,False,False,True
Menschen Facebook binden isis terroristische Gruppe muslimischer Extremisten,de_translation,people facebook tie isis terrorist group muslim extremist,1,False,False,False,False,True,False,False,False,True
check tube post black man go epic rant ferguson rioter message deliver childish cartoon ish emotion african american get,en_original,check tube post black man go epic rant ferguson rioter message deliver childish cartoon ish emotion african american get,1,False,False,False,False,True,True,False,False,False
Compruebe el tubo post negro go go rant ferguson ferguson Mensaje de la mano Entregue la caricatura infantil ish emoción afroamericano obtenga,es_translation,check tube post black man go epic rant ferguson rioter message deliver childish cartoon ish emotion african american get,1,False,False,False,False,True,True,False,False,False
Vérifiez le tube post noir go epic rant Ferguson Rioter Message délivrer un dessin animé émotion émotion afro-américaine,fr_translation,check tube post black man go epic rant ferguson rioter message deliver childish cartoon ish emotion african american get,1,False,False,False,False,True,True,False,False,False
Check Tube Post Black Man Go Epic Rant Ferguson Randaler Nachricht liefern kindisch -karikon ish emotion afroamerikaner,de_translation,check tube post black man go epic rant ferguson rioter message deliver childish cartoon ish emotion african american get,1,False,False,False,False,True,True,False,False,False
love pussy staten island spit cop love happen mike brown strong arm thug people burn ferguson eric garnier wrong choke death protest mafia control staten island burn car,en_original,love pussy staten island spit cop love happen mike brown strong arm thug people burn ferguson eric garnier wrong choke death protest mafia control staten island burn car,1,True,False,False,True,True,True,False,False,False
Love Pussy Staten Island Spit Cop Hubo Mike Brown Strong Arm Thug People Burn Ferguson Eric Garnier Choque Incribe Información Muerte Mafia Control Staten Island Burn Car,es_translation,love pussy staten island spit cop love happen mike brown strong arm thug people burn ferguson eric garnier wrong choke death protest mafia control staten island burn car,1,True,False,False,True,True,True,False,False,False
Love Pussy Staten Island Spit Cop Love Happen Mike Brown Strong Arm THUG PERSONNES BROPPE,fr_translation,love pussy staten island spit cop love happen mike brown strong arm thug people burn ferguson eric garnier wrong choke death protest mafia control staten island burn car,1,True,False,False,True,True,True,False,False,False
agree protestor,en_original,agree protestor,0,False,False,False,False,False,False,False,False,False
Acuerde el manifestante,es_translation,agree protestor,0,False,False,False,False,False,False,False,False,False
Convention de manifestation,fr_translation,agree protestor,0,False,False,False,False,False,False,False,False,False
Protestierer zustimmen,de_translation,agree protestor,0,False,False,False,False,False,False,False,False,False
mike browns father boooshit,en_original,mike browns father boooshit,1,True,False,False,True,False,False,False,False,False
Mike Browns padre boooshit,es_translation,mike browns father boooshit,1,True,False,False,True,False,False,False,False,False
Mike Browns Père Boooshit,fr_translation,mike browns father boooshit,1,True,False,False,True,False,False,False,False,False
Mike Browns Vater Boooshit,de_translation,mike browns father boooshit,1,True,False,False,True,False,False,False,False,False
guy right point judge speak ability judge messege racist fuck suck dick like medium focus thing matter cnn shit,en_original,guy right point judge speak ability judge messege racist fuck suck dick like medium focus thing matter cnn shit,1,True,False,False,True,False,False,False,False,False
Guy Punto correcto Juez hablar habilidad Juez Messege Racist Fuck chupa la polla como la cosa de enfoque medio importa Cnn mierda,es_translation,guy right point judge speak ability judge messege racist fuck suck dick like medium focus thing matter cnn shit,1,True,False,False,True,False,False,False,False,False
Guy Right Point Judge Speak Capacité juge Messege Raciste Fuck Suck Dick Like Medium Focus Thing Matter Cnn Shit,fr_translation,guy right point judge speak ability judge messege racist fuck suck dick like medium focus thing matter cnn shit,1,True,False,False,True,False,False,False,False,False
Guy richtiger Punkt Richter Speak -Fähigkeit Richter Messenge Rassist Fuck Suck Dick wie mittlere Fokus Sache Materie Cnn Shit,de_translation,guy right point judge speak ability judge messege racist fuck suck dick like medium focus thing matter cnn shit,1,True,False,False,True,False,False,False,False,False
moral story reach cops gun probably gunna shoot white black,en_original,moral story reach cops gun probably gunna shoot white black,0,False,False,False,False,False,False,False,False,False
Historia moral Reach Cops Gun probablemente Gunna dispara Blanco Blanco,es_translation,moral story reach cops gun probably gunna shoot white black,0,False,False,False,False,False,False,False,False,False
l'histoire morale atteint le pistolet flics probablement gunna tire blanc noir,fr_translation,moral story reach cops gun probably gunna shoot white black,0,False,False,False,False,False,False,False,False,False
Moralische Geschichte Erreicht Polizisten Waffe wahrscheinlich Gunna schießen weiß schwarz,de_translation,moral story reach cops gun probably gunna shoot white black,0,False,False,False,False,False,False,False,False,False
masri close isis america,en_original,masri close isis america,1,True,False,False,False,False,False,False,False,False
Masri schließen Isis America,de_translation,masri close isis america,1,True,False,False,False,False,False,False,False,False
know chimper compassion mud pump heart,en_original,know chimper compassion mud pump heart,1,False,False,False,False,True,True,False,False,False
Conozca el corazón de la bomba de barro compasión de chimpere,es_translation,know chimper compassion mud pump heart,1,False,False,False,False,True,True,False,False,False
Connaître le cœur de la pompe à boue de la compassion de compassion,fr_translation,know chimper compassion mud pump heart,1,False,False,False,False,True,True,False,False,False
Kennen Sie Schmuck Mitgefühl Schlammpumpe Herz,de_translation,know chimper compassion mud pump heart,1,False,False,False,False,True,True,False,False,False
believe wanna believe care bassem masri idiot,en_original,believe wanna believe care bassem masri idiot,1,True,False,False,False,False,False,False,False,False
cree que quiero creer cuidado bassem masri idiota,es_translation,believe wanna believe care bassem masri idiot,1,True,False,False,False,False,False,False,False,False
Croire à croire croire les soins Bassem masri idiot,fr_translation,believe wanna believe care bassem masri idiot,1,True,False,False,False,False,False,False,False,False
"Glauben Sie, dass Care Bassem Masri Idiot glauben will",de_translation,believe wanna believe care bassem masri idiot,1,True,False,False,False,False,False,False,False,False
bassem masri terrorist isis,en_original,bassem masri terrorist isis,1,False,False,False,False,True,False,False,False,True
Bassem Masri Terrorista ISIS,es_translation,bassem masri terrorist isis,1,False,False,False,False,True,False,False,False,True
Bassem Masri terroriste Isis,fr_translation,bassem masri terrorist isis,1,False,False,False,False,True,False,False,False,True
waist time try reason police spit thug try defend criminal brown losing matter grand jury decision live,en_original,waist time try reason police spit thug try defend criminal brown losing matter grand jury decision live,1,True,False,True,False,False,False,False,False,False
Tiempo de cintura intenta la razón por la que la policía Spit Thug intente defender el criminal Brown perdiendo el asunto Gran jurado decisión en vivo,es_translation,waist time try reason police spit thug try defend criminal brown losing matter grand jury decision live,1,True,False,True,False,False,False,False,False,False
Temps de taille Essayez la raison pour laquelle la police crache Thug essaie de défendre le criminel Brown perdant la matière Grand Jury Décision en direct,fr_translation,waist time try reason police spit thug try defend criminal brown losing matter grand jury decision live,1,True,False,True,False,False,False,False,False,False
"Taille Zeit versuchen, Grund zu der Polizei spuckte Schläger, versuche kriminelle braun zu verteidigen",de_translation,waist time try reason police spit thug try defend criminal brown losing matter grand jury decision live,1,True,False,True,False,False,False,False,False,False
wish masri dead,en_original,wish masri dead,1,True,False,False,False,False,False,False,False,False
Deseo Masri muerto,es_translation,wish masri dead,1,True,False,False,False,False,False,False,False,False
Souhaiter Masri mort,fr_translation,wish masri dead,1,True,False,False,False,False,False,False,False,False
Wünsche Masri tot,de_translation,wish masri dead,1,True,False,False,False,False,False,False,False,False
collapse usa possibility consider boil dictatorship evil reprisal possibility new reconstruction people fundamentally conscious responsibility attain government bring effective valuable new start actually occur currently extremely questionable presently totalitarian manner direct interest economic military political cultural strict fundamentalist religious sectarian base enormous lie devious misanthropic criminal felonious machination imaginable regard mean population usa spy secret service severely neighbourhood forth possible manner restrict freedom addition violence emerge form openly covertly,en_original,collapse usa possibility consider boil dictatorship evil reprisal possibility new reconstruction people fundamentally conscious responsibility attain government bring effective valuable new start actually occur currently extremely questionable presently totalitarian manner direct interest economic military political cultural strict fundamentalist religious sectarian base enormous lie devious misanthropic criminal felonious machination imaginable regard mean population usa spy secret service severely neighbourhood forth possible manner restrict freedom addition violence emerge form openly covertly,0,False,False,False,False,False,False,False,False,False
"Kollapse USA Möglichkeit in Betracht ziehen Koch diktatur böse Repressalien Möglichkeit neuer Wiederaufbau Menschen grundsätzlich bewusste Verantwortung Erreichen von Regierung bringen wirksamen wertvollen Neuanfang tatsächlich extrem fraglich, derzeit total.",de_translation,collapse usa possibility consider boil dictatorship evil reprisal possibility new reconstruction people fundamentally conscious responsibility attain government bring effective valuable new start actually occur currently extremely questionable presently totalitarian manner direct interest economic military political cultural strict fundamentalist religious sectarian base enormous lie devious misanthropic criminal felonious machination imaginable regard mean population usa spy secret service severely neighbourhood forth possible manner restrict freedom addition violence emerge form openly covertly,0,False,False,False,False,False,False,False,False,False
actually shout fire crowded theater christopher hitchen demonstrate talk free speech look interviewee correct cop serve public way consistent serve public police department represent public race ethnicity rank hire bunch big tough black guy police department few black shoot death puny white guy felt humiliate get bitch slap teenager,en_original,actually shout fire crowded theater christopher hitchen demonstrate talk free speech look interviewee correct cop serve public way consistent serve public police department represent public race ethnicity rank hire bunch big tough black guy police department few black shoot death puny white guy felt humiliate get bitch slap teenager,1,True,False,False,True,False,False,False,False,False
actually shout fire crowded theater christopher hitchen demonstrate talk free speech look interviewee correct cop serve public way consistent serve public police department represent public race ethnicity rank hire bunch large tough black guy police department few black shoot death puny white guy felt humiliate get bitch slap teenager,en_synonym,actually shout fire crowded theater christopher hitchen demonstrate talk free speech look interviewee correct cop serve public way consistent serve public police department represent public race ethnicity rank hire bunch big tough black guy police department few black shoot death puny white guy felt humiliate get bitch slap teenager,1,True,False,False,True,False,False,False,False,False
"En realidad, grita fuego de teatro lleno de gente, Christopher Hitchen, demuestra hablar de libertad de expresión, mirada, entrevistado, correcto, COMBRA COMPLEZA CAMINO PÚBLICA SERVICIÓN DEL DEPARTAMENTO DE POLICÍA PÚBLICA Representación de la carrera de la raza pública Rango de rango Bunch Gun",es_translation,actually shout fire crowded theater christopher hitchen demonstrate talk free speech look interviewee correct cop serve public way consistent serve public police department represent public race ethnicity rank hire bunch big tough black guy police department few black shoot death puny white guy felt humiliate get bitch slap teenager,1,True,False,False,True,False,False,False,False,False
"En fait, crier le feu de feu, théâtre Christopher Hitchen, démontrer la liberté d'expression Look Interviewé Cop correct Servir public Way cohérent Service public Département de police représenter la race publique ethnicité Ranque de location Bunch Big Black Guy Department Police Department Black ShooT Death Puny Guy Breed Selon Humiliate",fr_translation,actually shout fire crowded theater christopher hitchen demonstrate talk free speech look interviewee correct cop serve public way consistent serve public police department represent public race ethnicity rank hire bunch big tough black guy police department few black shoot death puny white guy felt humiliate get bitch slap teenager,1,True,False,False,True,False,False,False,False,False
think kill,en_original,think kill,1,True,False,False,False,False,False,False,False,False
pensar matar,es_translation,think kill,1,True,False,False,False,False,False,False,False,False
penser à tuer,fr_translation,think kill,1,True,False,False,False,False,False,False,False,False
"Denken Sie, töten",de_translation,think kill,1,True,False,False,False,False,False,False,False,False
legalize marijuana problem stop,en_original,legalize marijuana problem stop,0,False,False,False,False,False,False,False,False,False
legalizar el problema de la marihuana parada,es_translation,legalize marijuana problem stop,0,False,False,False,False,False,False,False,False,False
