VideoId,Text,IsToxic,IsAbusive,IsThreat,IsProvocative,IsObscene,IsHatespeech,IsRacist,IsNationalist,IsSexist,IsReligiousHate
cT14IbTDW2c,let us all just relax slowly grabs 12 gauge,False,False,False,False,False,False,False,False,False,False
cT14IbTDW2c,should run all those motherfuckers over,True,True,False,True,False,False,False,False,False,False
cT14IbTDW2c,no talk get those fuckers off the road period i would have run the down let them sue,True,True,False,True,False,False,False,False,False,False
cT14IbTDW2c,plow through them they will get out of they way,True,True,False,True,False,False,False,False,False,False
cT14IbTDW2c,i would get my car and start doing burnouts in their faces either move or get smoked,True,True,True,False,False,False,False,False,False,False
cT14IbTDW2c,run them over,True,True,True,False,False,False,False,False,False,False
cT14IbTDW2c,the fuck are thes cops being a pussy,True,True,False,False,True,False,False,False,False,False
cT14IbTDW2c,california is so stupid just arrest all them and charge them drivers need to get too work to feed their families,True,False,False,False,False,True,True,True,False,False
cT14IbTDW2c,hope those fuckers get slammed with major fines fucking idiots,True,True,False,False,True,False,False,False,False,False
cT14IbTDW2c,one mustang needed in this situation lol skull skull,True,True,False,True,False,False,False,False,False,False
cT14IbTDW2c,should of ran everyone of them over,True,True,False,True,False,False,False,False,False,False
cT14IbTDW2c,i would just pop a couple of shots in the air and watch them scatter like roaches when a light turns on,True,True,False,True,False,False,False,False,False,False
cT14IbTDW2c,someone should have taken one for the team and plowed right through them,True,True,False,True,False,False,False,False,False,False
cT14IbTDW2c,nothing more hypocritical than a movement claiming to support blacks by blocking probably hundreds of blacks trying to get to their job to feed their god damn family,False,False,False,False,False,False,False,False,False,False
cT14IbTDW2c,ahhhhhhh i love this country,False,False,False,False,False,False,False,False,False,False
cT14IbTDW2c,useless cops talk to the protesters instead of breaking heads,True,True,False,False,False,False,False,False,False,False
cT14IbTDW2c,dumb ass people run over them all enraged_face,True,True,False,True,True,False,False,False,False,False
cT14IbTDW2c,if you are the parent of one of these kids you have failed the one job you had as a parent do not raise a cunt,True,True,False,False,False,False,False,False,False,False
cT14IbTDW2c,bored stupid kids,True,True,False,False,False,False,False,False,False,False
cT14IbTDW2c,german police is pretty nice but even they would have beat these protestors,False,False,False,False,False,False,False,False,False,False
cT14IbTDW2c,run them over,True,True,False,True,False,False,False,False,False,False
cT14IbTDW2c,run the black cunts over,True,True,False,True,True,True,True,False,False,False
cT14IbTDW2c,ram those pricks,True,True,False,True,False,False,False,False,False,False
cT14IbTDW2c,next time they do that line up some cars and start making burnout smoke to riot gas them non lethal and eficient double check if it actualy is non lethal of course xd,True,True,False,True,False,False,False,False,False,False
cT14IbTDW2c,i just thought about how to deal with this situation as a driver the only working thing i came up with was getting out of the car getting other drivers of stoppes cars to come with me and clean the road but that is self justice something we all support irrationally and are against rationally,True,True,False,True,False,False,False,False,False,False
cT14IbTDW2c,fucking idiots get outta the way some people got to get to work,True,True,False,False,False,False,False,False,False,False
cT14IbTDW2c,too bad nobody ran them down hmmmm if your dumbass lives matter then stay the fuck out of the street duh face_with_rolling_eyes face_with_rolling_eyes,True,True,False,True,True,False,False,False,False,False
cT14IbTDW2c,run them over they are on a freaking freeway,True,True,True,True,False,False,False,False,False,False
cT14IbTDW2c,pepper spray them for them to create a dangerous situation for motorists they should get put in jail this is not s peaceful protest if they are infringing upon other citizens rights to move freely and about but cannot due to the blockade of so called protestors creating a dangerous situation,False,False,False,False,False,False,False,False,False,False
cT14IbTDW2c,arrest all of them,False,False,False,False,False,False,False,False,False,False
cT14IbTDW2c,i wish so much that when these types of protesters come out they would all be arrested fined and taught the law,False,False,False,False,False,False,False,False,False,False
cT14IbTDW2c,this made me mad why did not you just point guns at them,False,False,False,False,False,False,False,False,False,False
cT14IbTDW2c,they should all be arrested for blocking a highway if you want to protest do it somewhere else,False,False,False,False,False,False,False,False,False,False
cT14IbTDW2c,they should have protest in furgison not in so cal take the fight to wear it started,False,False,False,False,False,False,False,False,False,False
cT14IbTDW2c,do people not realize blocking roads and pissing people off do not get people onto your side,False,False,False,False,False,False,False,False,False,False
cT14IbTDW2c,if i ever get in a situation where i can run these assholes over i will,True,True,True,True,False,False,False,False,False,False
cT14IbTDW2c,just run there stupid ass over there stupid enough to stand in the middle of a freeway,True,True,False,True,True,False,False,False,False,False
cT14IbTDW2c,if i was there i will sue them for the time they wast,False,False,False,False,False,False,False,False,False,False
cT14IbTDW2c,these californians deserve this backup since they elect people that allow this to happen without consequences if they tried that where i lived they would be shot at and runned over,True,True,False,True,False,True,True,True,False,False
cT14IbTDW2c,there is a lot more drivers there they should have banded together and collectively beat the living shit out of every one of those little pricks,True,True,True,False,False,False,False,False,False,False
cT14IbTDW2c,run them over,True,True,False,True,False,False,False,False,False,False
cT14IbTDW2c,the crazy thing is i thought offices never do anything i want of random people over,False,False,False,False,False,False,False,False,False,False
cT14IbTDW2c,would have been satisfying if someone threw a molotov in the middle of the group,True,True,False,True,False,False,False,False,False,False
cT14IbTDW2c,run them over ignorant fucks the world will do better without them,True,True,False,True,True,False,False,False,False,False
cT14IbTDW2c,one paintball gun is all it takes,True,True,False,True,False,False,False,False,False,False
cT14IbTDW2c,tell them they are breaking the law by blocking an interstate and traffic will be let through if you get hit by vehicles after being told to leave not only will the drivers of the vehicles noy be charged but any injuries incurred will be billed to the retards standing in the street,True,True,False,False,False,False,False,False,False,False
cT14IbTDW2c,this is where the gas grenades pepper spray and knight stick would be applied,False,False,False,False,False,False,False,False,False,False
cT14IbTDW2c,i do not get it are not they protesting to like the wrong people,False,False,False,False,False,False,False,False,False,False
cT14IbTDW2c,cannot you just stand on the side of the freeway instead of blocking thousands of cars,False,False,False,False,False,False,False,False,False,False
cT14IbTDW2c,if a patient is ever in an ambulance during this and get injured worse because they cannot make it to the hospital the protestors should be liable and if they die then the protestors should be charged with man slaughter,True,True,False,True,False,False,False,False,False,False
cT14IbTDW2c,you should be legally allowed to run them down with no consequences,True,True,False,True,False,False,False,False,False,False
cT14IbTDW2c,give me the keys to a county snowplow i will get that road open as soon as possible,True,True,False,True,False,False,False,False,False,False
cT14IbTDW2c,and if my kid did that i would beat the shit out of him,True,True,False,True,True,False,False,False,False,False
cT14IbTDW2c,if this happen i would drive though them if i have to n if a cop does that shit then they mess up letting them finish what they have to say like have need to get home or work you see how long that line of cars was holding people up for there bullshit,True,True,True,True,False,False,False,False,False,False
cT14IbTDW2c,idiotz,True,True,False,False,False,False,False,False,False,False
cT14IbTDW2c,stupid niggers,True,False,False,False,False,True,True,False,False,False
cT14IbTDW2c,i do not give a fuck what it is they are protesting about do not block fucking traffic you cunts why piss on everyone else s day honestly such cunts there should be a law where if you intentionally block traffic drivers reserve the right to run you the fuck over it is just quickening the darwinism process anyway,True,True,False,False,True,False,False,False,False,False
cT14IbTDW2c,how did they get the time off from work jk,False,False,False,False,False,False,False,False,False,False
cT14IbTDW2c,those dumb fucks screwing fellow citizens over instead of protesting against the police man_facepalming,True,True,False,False,False,False,False,False,False,False
cT14IbTDW2c,i would have pressed my m button and shoot the tsar bombar outta my car into them,True,True,False,True,False,False,False,False,False,False
cT14IbTDW2c,everyone wants to be the next mlk but the issue is that there are not problems in the us anymore that require another mlk,False,False,False,False,False,False,False,False,False,False
cT14IbTDW2c,it is hilarious seeing these morons get hit by cars,True,True,False,True,False,False,False,False,False,False
cT14IbTDW2c,run them over,True,True,False,True,False,False,False,False,False,False
cT14IbTDW2c,how not to do a protest,False,False,False,False,False,False,False,False,False,False
cT14IbTDW2c,i understand the point black lives do matter but blocking off traffic like that like wth is that going to do there is people that need to go places hospitals family work etc and this to me is just plane stupid,True,True,False,False,False,False,False,False,False,False
cT14IbTDW2c,1 obstructing interstate commerce is a federal felony offence 2 the cops are useless 3 blm is the democrats modern version of the racist terroristic kkk they also created 4 these are not protesters they are rioters 5 the drivers of the first row of cars are wimps 6 imagine dying in a ambulance stopped in a traffic jam miles long,True,True,False,False,False,False,False,False,False,False
cT14IbTDW2c,where are the trucks with foghorns,False,False,False,False,False,False,False,False,False,False
cT14IbTDW2c,these people did more to hurt their because than help it that day no one that is rational is on the blacklivesmatter side anymore,False,False,False,False,False,False,False,False,False,False
cT14IbTDW2c,a supra needs to let off if that happens,False,False,False,False,False,False,False,False,False,False
cT14IbTDW2c,signs saying black lives matter and they are blocking black and white people wtf,True,True,False,True,False,False,False,False,False,False
cT14IbTDW2c,should have dealt with them with force,False,False,False,False,False,False,False,False,False,False
cT14IbTDW2c,drive through them,True,True,False,True,False,False,False,False,False,False
cT14IbTDW2c,stupid american,True,False,False,False,False,True,True,True,False,False
cT14IbTDW2c,if it was me i would have just kept going if you get hit you get hit i would slowly push my way through people who did that need to grow the fuck up,True,True,False,True,False,False,False,False,False,False
cT14IbTDW2c,it should be a law if there a protesters blocking the street you should be leagaly allowed to run them over,True,True,False,True,False,False,False,False,False,False
cT14IbTDW2c,pepper spray the cunts they will run,True,True,False,True,True,False,False,False,False,False
cT14IbTDW2c,bunch of pussies who have nothing better to do than to cry about problems that are only escalated because they do stupid shit like this,True,True,False,False,True,False,False,False,False,False
dDbRyFIkNII,i am not informed 100 about what exactly is going on but that was fucked up i am trying to find reliable resources to understand this i cannot believe that it is 2014 and thing like this is still happening,False,False,False,False,False,False,False,False,False,False
dDbRyFIkNII,the people in ferguson have to loot the oly thing the goverment cares about is the economy fuck it up n they will make an effort to stop crooked cops,True,True,False,True,True,False,False,False,False,False
dDbRyFIkNII,good quality,False,False,False,False,False,False,False,False,False,False
dDbRyFIkNII,wow,False,False,False,False,False,False,False,False,False,False
dDbRyFIkNII,welcome to new world order,True,True,False,True,False,False,False,False,False,False
dDbRyFIkNII,who the hell cares if there are people peacefully protesting if the police feels threatened they are going to act i say blow them fuckers in the face with some tg that is what follows a riot,True,True,False,True,True,False,False,False,False,False
dDbRyFIkNII,i want to toss one of those gernades lol not at anyone of course but at a range that would be the fucking shit,True,True,False,False,True,False,False,False,False,False
dDbRyFIkNII,ah memories by the way you brought the fireworks,False,False,False,False,False,False,False,False,False,False
dDbRyFIkNII,stuff like this is one of the reasons why people associate violence and danger with black people,True,False,False,False,False,True,True,False,False,False
dDbRyFIkNII,that was awesome,False,False,False,False,False,False,False,False,False,False
dG7mZQvaQDk,i love this lady we need more strong women like peggy hubbard,False,False,False,False,False,False,False,False,False,False
dG7mZQvaQDk,peggy i am a native american and i love you honey,False,False,False,False,False,False,False,False,False,False
dG7mZQvaQDk,huge wisdom here for anyone that has ears to listen,False,False,False,False,False,False,False,False,False,False
dG7mZQvaQDk,mrs hubbard you get it jamyla bolden died so needlessly,False,False,False,False,False,False,False,False,False,False
dG7mZQvaQDk,amen amen sister you go you strong black woman i got your back,False,False,False,False,False,False,False,False,False,False
dG7mZQvaQDk,a stand up woman speaking the truth i applaud you you have more guts then most young lady,False,False,False,False,False,False,False,False,False,False
dG7mZQvaQDk,peggy you are blessed with so much courage heart thank you for your honesty passion in this matter whatawoman,False,False,False,False,False,False,False,False,False,False
dG7mZQvaQDk,this lady should be the first guest speaker at all of al sharpton s rallies seriously,False,False,False,False,False,False,False,False,False,False
dG7mZQvaQDk,i love this woman this is a voice that matters fuck black lives matter,True,True,False,False,False,False,False,False,False,False
dG7mZQvaQDk,that is a real parent a real mother nothing but real talk right there she learned well from her mom a voice of truth in a sea of bullshit,False,False,False,False,False,False,False,False,False,False
dG7mZQvaQDk,finally a black person with a unbiased opinion an incredibly high percentage of black lives are lost among themselves and only an extremely small fraction from police black people need to take responsibility for their violence,True,False,False,False,False,True,True,False,False,False
dG7mZQvaQDk,thank you for the truth and speaking for the innocent,False,False,False,False,False,False,False,False,False,False
dG7mZQvaQDk,this is sad disgrace to all black people,True,True,False,False,False,False,False,False,False,False
dG7mZQvaQDk,my mother told me the same thing god bless this woman,False,False,False,False,False,False,False,False,False,False
dG7mZQvaQDk,this gal calls it spot on way to go ms peggy way to go,False,False,False,False,False,False,False,False,False,False
dG7mZQvaQDk,when i c the blk lives matter bullshit witch i call bullshit 5 black people were killed in a five period in newark nj where were they i call bullshitb,True,True,False,True,True,False,False,False,False,False
dG7mZQvaQDk,love it i same the saem thing go peggy stupid ya killing ya selves more quicker than stlpd could ever wakeup,False,False,False,False,False,False,False,False,False,False
dG7mZQvaQDk,niggas love being the victim in any situation that is why i separate my from them and other black people need to do the same,True,False,False,False,False,True,True,False,False,False
dG7mZQvaQDk,oh that politicians had the same style of oratory peggy hubbard in one short video rings out a message that is loud and clear to those who will listen ok i am in england and thankfully we do not have a gun culture but i have seen enough of the american scene in my time to know that peggy drops all the hang wringing crap to tell it as it is her words should be written down and posted in the white house mavbe someone there would listen and act,False,False,False,False,False,False,False,False,False,False
dG7mZQvaQDk,everyone share this this women is awesome,False,False,False,False,False,False,False,False,False,False
dG7mZQvaQDk,this is real black leadership real revolutionary radicalism,False,False,False,False,False,False,False,False,False,False
dG7mZQvaQDk,respect,False,False,False,False,False,False,False,False,False,False
dG7mZQvaQDk,thanks for being a voice of sanity in the black community peggy,False,False,False,False,False,False,False,False,False,False
dG7mZQvaQDk,wow people like me cannot say these things she rightly says because the pc police will get offended tag me as racist and therefore no truth i might speak is given credence society as we know it but her speaking the truth magnifies it like no one else could why are not we elevating people like her to school boards city councils mayors state and national office,False,False,False,False,False,False,False,False,False,False
dG7mZQvaQDk,and she is a us navy vet mad respect,False,False,False,False,False,False,False,False,False,False
dG7mZQvaQDk,day day thisisacommentary here is some truth for you,False,False,False,False,False,False,False,False,False,False
dG7mZQvaQDk,so this bitch is talking about people like dylan roof james holmes jared loughner jerad miller tim mcveigh jared loughner jim david adkisson paul hill scott roeder frazier glen miller jr elliot rodger buford of furrow john r houser etc then right,True,True,False,False,False,False,False,False,False,False
dG7mZQvaQDk,thank you for being real when i heard about the little girl i thought the same thing where is the rage the media and who is ever behind them want to promote racial tensions and nobody in the black community wants to talk about the elephant in the room its almost like everything in the media and music scene promotes a thug life,False,False,False,False,False,False,False,False,False,False
dG7mZQvaQDk,peggy is my hero,False,False,False,False,False,False,False,False,False,False
dG7mZQvaQDk,awesome women,False,False,False,False,False,False,False,False,False,False
dG7mZQvaQDk,i think alot of black people are tired with gun violence and gangs and ignorance in their communities and want it to stop and yes their are bad people of all races but what is gets to me with that statement when you talk about things in the black commuity people are so quick to say their are bad people in every race and say your putting blacks down when you just want your people do better and caring their selfs in a repectful way,False,False,False,False,False,False,False,False,False,False
dG7mZQvaQDk,tips hat to this class a lady well spoken,False,False,False,False,False,False,False,False,False,False
dG7mZQvaQDk,if only more black people were like her,False,False,False,False,False,False,False,False,False,False
dG7mZQvaQDk,she is right blacks are in the shitter because of themselves not the white man,True,True,False,False,True,False,False,False,False,False
dG7mZQvaQDk,obama should be saying exactly what this lady is saying instead he is defending the thugs she should clean up her language however,True,False,False,False,False,True,True,False,False,False
dG7mZQvaQDk,so proud of a woman mother that stands on principle morality just plain common sense and not afraid to go against the tide of her cultures wrong path kudos to you peggy also to the mother of the 2 kids in hattiesburg ms that killed 2 police officers then stands up and takes responsibility as we all should you two are wonderful role models and my latest heroines,False,False,False,False,False,False,False,False,False,False
dG7mZQvaQDk,basically she is doing more than talking black lives do matter but i guess when looting and rioting take place only for an asshole whose robbed and druged up the community she hits on all points and was on cnn she believes there is police brutality and wants reforms she knows there is racism but she also knows nobody is going to take a fucking second look at black rights till black people take a stand against self destruction,False,False,False,False,False,False,False,False,False,False
dG7mZQvaQDk,i have spread this video everywhere awesome,False,False,False,False,False,False,False,False,False,False
dG7mZQvaQDk,thank you peggy,False,False,False,False,False,False,False,False,False,False
dG7mZQvaQDk,the female uncle ruckus,False,False,False,False,False,False,False,False,False,False
dG7mZQvaQDk,well damn good for her,False,False,False,False,False,False,False,False,False,False
dG7mZQvaQDk,i am a white person who always thought everyone should be treated fairly with blm and creating a bunch of bull and threatening my life and others by making it harder for cops to take out the bad guys maybe not drawing their weapon fast enough or killing the spirit of being a hero or killing the spirit of not putting out 110 and doing just enough to comply no more rushing into burning houses type of thing from a few bad cops and with the neighborhood gangs in my neighborhood having the heat taken off them emboldening them and not the spirit of all lives matter a form of racism in itself blm is causing a feeling that black lives do not matter peggy gave me hope there is still hope that there is still intelligence in the black community so maybe we can still all live together i am one less white guy willing to join the kkk because of peggy not blm,True,False,False,False,False,True,True,False,False,False
dG7mZQvaQDk,i agree with this sista 100,False,False,False,False,False,False,False,False,False,False
dG7mZQvaQDk,as a black person all i have to say is thank you for speaking the truth too many blacks out there causing trouble dressing like idiots and bring trouble to themselves killing eachother causing crimes then they complain the police are after them when they are up to no good i am just glad my parents grew me up properly i stayed away from the garbage,True,False,False,False,False,True,True,False,False,False
dG7mZQvaQDk,thank you mrs hubbard i am so happy that you said what needs saying blacks are allowing their neighborhoods to be destroyed by themselves black mother s stand up and be counted black fathers keep your ass home and help raise your children peggy chief i have your back fair winds and following seas shipmate slap heard round the world needs to happen a whole lot more my sisters,False,False,False,False,False,False,False,False,False,False
dG7mZQvaQDk,you go girl have listened twice retweeted twice first from gateway pundent second from youtube god bless ms hubbard and god s speed with your vid,False,False,False,False,False,False,False,False,False,False
dG7mZQvaQDk,great video thank you peggy,False,False,False,False,False,False,False,False,False,False
dG7mZQvaQDk,this brave woman brought tears to my eyes,False,False,False,False,False,False,False,False,False,False
dG7mZQvaQDk,peggy hubbard for president 2016,False,False,False,False,False,False,False,False,False,False
dG7mZQvaQDk,very respectable woman,False,False,False,False,False,False,False,False,False,False
dG7mZQvaQDk,too much logic and intelligence she must be mixed race with some intelligent white dna in her,True,False,False,False,False,True,True,False,False,False
dG7mZQvaQDk,amen tell it like it is sister amen,False,False,False,False,False,False,False,False,False,False
dG7mZQvaQDk,we need more people like peggy hubbard i support her as mother of the year with common sense,False,False,False,False,False,False,False,False,False,False
dG7mZQvaQDk,i think i just fell in love,False,False,False,False,False,False,False,False,False,False
dG7mZQvaQDk,one must be fucking stupid if one attacks a police officer and expects to get away with it without any response from the police,True,True,False,False,True,False,False,False,False,False
dG7mZQvaQDk,i never heard of this woman before but i am loving what she is saying this message is too valuable not to get out there thanks for posting,False,False,False,False,False,False,False,False,False,False
dG7mZQvaQDk,hit the nail on the head black lives matter guess not when they keep killing each other over stupid shit like gang loyalty and selling drugs instead of getting an education so you are able to get out of the getto your in i take my hat off to those parents who raise there chlidren to have values and pride in who they are because those are the ones who will make a difference not the drug dealing gang bangers the only difference there going to makeis one less for the holiday dinners,False,False,False,False,False,False,False,False,False,False
