VideoId,Text,IsToxic,IsAbusive,IsThreat,IsProvocative,IsObscene,IsHatespeech,IsRacist,IsNationalist,IsSexist,IsReligiousHate
9pr1oE34bIM,yea fuck that store clerk to how dare he try to do his job,True,True,False,True,True,False,False,False,False,False
9pr1oE34bIM,all this info being put out about mike brown why is nobody bringing up the fact off darrin wilson tested positive for illegal mood altering non prescription steroids in his post shooting toxicology test one also has to wonder if this info was given to the grand jury doubtful,False,False,False,False,False,False,False,False,False,False
9pr1oE34bIM,great vid,False,False,False,False,False,False,False,False,False,False
9pr1oE34bIM,the only real question that needs to be asked is this why would mike brown rush a cop who has already drawn his weapon and has already shot at him the way you answer will show your true colors to think that a black male would disregard his own life to kill a cop and escalate his punishment from probation for petty theft to the death penalty for killing a cop is utterly absurd if you truly believe that someone who was going to start college the next week would do that then i am sorry but you are a racist,False,False,False,False,False,False,False,False,False,False
9pr1oE34bIM,this 18 year old was just another useless negro who could barely pass inner city high school i am glad he was shot dead on the street like a dog,True,False,False,False,False,True,True,False,False,False
9pr1oE34bIM,very moving very thought out,False,False,False,False,False,False,False,False,False,False
9pr1oE34bIM,how can the police concentrate on any investigation with all these people if they can be called that misbehaving i hope this investigation gets all cancelled until they can behave and they let the police work everyone says this guy committed suicide by cop by attacking the police in the first place how more clear can this be you just do not disrespect the police that way,True,True,False,True,False,False,False,False,False,False
9pr1oE34bIM,25 lmfao,False,False,False,False,False,False,False,False,False,False
9pr1oE34bIM,you are the man stefan,False,False,False,False,False,False,False,False,False,False
9pr1oE34bIM,100 agree people are up in arms but they need to find out more information before rioting thinking that getting high or doing drugs then robbing a store carelessly and then walking in the middle of the street and screaming at a cop attacking and reaching for the gun is unarmed not to mention his size either then people are very gullible i find it funny how all races are racist to each other and blacks are racist to whites but every single time someone is racist to a black person then everyone throws their hands up and gets pissed off at white people i am not a racist person but i do not want to sit here while everyone believes that white people are the only racist people just because what happened in the past makes me sick to think i have to grow up in this generation,False,False,False,False,False,False,False,False,False,False
9pr1oE34bIM,is this true police originally said robbery had nothing to do with stop so why are you claiming he noticed the cigars,False,False,False,False,False,False,False,False,False,False
9pr1oE34bIM,thank you for yet another sobering analysis stefan the amount of bias and deception from the left and the mainstream media has been insane,False,False,False,False,False,False,False,False,False,False
9pr1oE34bIM,stefan molyneux please explain how my inquiry about the handling of the subsequent unrest is circular language games a pretty simple and straightforward question that you seem to be avoiding in a very unnecessarily hostile manner what is the justification for the heavy handed militaristic response to looting why would officials handling the situation there decide initially to block access to the area by media i have a family member that lives in that area and he can attest to the unprofessionalism and hostility from the law enforcement that was handling it early on if i am incorrect on this info please direct toward some facts regarding this i still do not understand why you went straight to attacking me i have respect for your logic when you are willing to share it thank you in advance hopefully you will not continue to insult me for whatever reason you chose,False,False,False,False,False,False,False,False,False,False
9pr1oE34bIM,this was about race as much as this news article that got no national media attention just last week,False,False,False,False,False,False,False,False,False,False
9pr1oE34bIM,he does not look like a gentle giant to me on the video of him robbing and stealing he looks like just another disgusting thieving thug,True,True,False,False,False,True,True,False,False,False
9pr1oE34bIM,omg stefan that rap was so hysterical anyway good news i guess to know that whatshisname is douche and deserved to die premptive strike made by officer darren wilson huzzah for another trash taken off the streets probably should cure the disease rather than treat the symptoms though the disease being the ignorance and self entitlement of some communities in the lower class getting out of poverty is not easy if your starting point is not easy but its still feasible with the right amount of drive,True,True,False,True,False,False,False,False,False,False
9pr1oE34bIM,my god look at this raw footage shocking ferguson riots watch and see what this guy did do my god hd,False,False,False,False,False,False,False,False,False,False
9pr1oE34bIM,stefan molyneux why do you hate blacks so much actually i am not surprised it is the bloody british in you you people conquered us when we did absolutely nothing to you the more freedom we gain as the decades go on the more you hate us if you were not so pale one would wonder if your mother was a black woman,True,False,False,False,False,True,True,True,False,False
9pr1oE34bIM,your an educated dumb assss rap is rap its not real its people like you i dispise,True,True,False,False,False,False,False,False,False,False
9pr1oE34bIM,seriously youtube go fuck yourself i find a comment on my android phone i want to reply to but of course i cannot scroll copy or paste while posting a comment on an android device because it is only fucking almost 2015 and our technology just is not able to handle such a mountainous task so i hop on the computer and try looking for the goddamned comment but of course the comment system on youtube is just so beyond fucked up that searching for a comment is completely impossible an hour later and i still cannot find the fucking thing i have to search for the string read more and then click on every single stupid fucking comment to expand them all before i can then search for a piece of the comment that i want to find from a phrase i can remember and that is after having to click on every fucking view all xxx comments and expand those and then if by some miracle of christ alfuckingmighty i actually found the piece of shit comment by some moron who it would not even matter if i replied because he is a thick skulled inbred troglodytic fucknut anyway it would automatically scroll me down 200 pages of comments right after i clicked reply so i could not copy paste quote etc without having to scroll up and down for an hour because god forfuckingbid the reply box was right underneath the actual comment i was replying to,True,True,False,True,True,False,False,False,False,False
9pr1oE34bIM,stefan excellent you obviously have a better understanding of the events surrounding this unfortunate event than our president i call it unfortunate because officer wilson life has been destroyed for doing his job my fear is that police will hesitate when finding themselves in this rapidly growing situation thank you for your in depth and honest dissertation tom kelver seek help go back to school and get off the drugs,True,True,False,False,False,False,False,False,False,False
9pr1oE34bIM,your gentle giant seems to have robbed a store and later assaulted an armed police officer so much for the school boy look you were hoping for thug life comes with a high price,True,False,False,False,False,True,True,False,False,False
9pr1oE34bIM,bullshit stef police officers have pepper spray stun guns and a number of non lethal methods at their immediate disposal the real question should these versions of the events hold true is why was the gun the first option the officer went for,True,True,False,False,False,False,False,False,False,False
9pr1oE34bIM,it is better for society for the greater good that michael brown went off the rails now before he got ushered through college life on an athletic scholarship and became a brown killer like o h simpson became o lj was found civilly liable y know,True,False,False,False,False,True,True,False,False,False
9pr1oE34bIM,this video would be more interesting if stefan were taking his clothes off he is so sexy after all this case is really not that hard to understand why would a cop who had a good record for 3 years of service shoot a teenager with his hands up the witness and friend lied which started the protests and a snowball effect then ensued all you have to do is watch the video in the store and it shows brown was aggressive is it so hard to believe from that evidence that he made a huge error in judgement in fighting a police officer no it is not,False,False,False,False,False,False,False,False,False,False
9pr1oE34bIM,awnser to 24 15 question aim for the leg,False,False,False,False,False,False,False,False,False,False
9pr1oE34bIM,all of these people talking about this stupid subject i do not care if your blue or purple my cousin was killed by a drunk african driver and was left there to die and were did that go only on local news and do you see me rioting outside no i am sorry to michael s family i truly am but everyone looses someone but when people get violent about it then what are people so post to think about those people,False,False,False,False,False,False,False,False,False,False
9pr1oE34bIM,dude commits 3 felonies including assaulting a police officer before he is shot and killed are you serious this is a race riot to distract from the fact that a cop was doing his job case closed justice served on the street that day,False,False,False,False,False,False,False,False,False,False
9pr1oE34bIM,the only difference is the color of your skin do people still say that,False,False,False,False,False,False,False,False,False,False
9pr1oE34bIM,gentle gentl giant,False,False,False,False,False,False,False,False,False,False
9pr1oE34bIM,youtube com watch v 6yfbbt6dvhg you did research and you did not come across the information of white construction workers who witnessed mike brown shot with his hands up,False,False,False,False,False,False,False,False,False,False
9pr1oE34bIM,was stefan ever a victim of police discrimination the game of white supremacy is to deny any involvement and play the victim when blacks complain it never fails watch the comments,True,False,False,False,False,True,True,False,False,False
9pr1oE34bIM,well here ya go young white man killed by a non white some say black cop no media outcry almost no media anything i had to search for this,False,False,False,False,False,False,False,False,False,False
9pr1oE34bIM,facts prove he was a thug,True,True,False,False,False,False,False,False,False,False
9pr1oE34bIM,if michael brown was asian his name would be dindu nuffin wong,True,False,False,False,False,True,True,False,False,False
9pr1oE34bIM,love dem gangzta lyreks,False,False,False,False,False,False,False,False,False,False
9pr1oE34bIM,good balanced unbiased video this story is so sad smh,False,False,False,False,False,False,False,False,False,False
9pr1oE34bIM,hey last week in kansas city mo a black man snuck into a retirement housing broke into a house beating 80 year old couple to death then went outside attempted to hot wire antique car three neighbors came out of their town houses mr howell afro american took his 12 gauge shot gun executed them by blowing their heads off he was only one armned a known felon who had gotten out of a previous murder charge because they could not find the young girls body now that is o k because they were old d white people caucasians where is al sharpeton jesse jackson now,True,True,False,True,False,False,False,False,False,False
9pr1oE34bIM,thank you stefan,False,False,False,False,False,False,False,False,False,False
9pr1oE34bIM,i have told some people on facebook to hold off judgment till the all the facts are in i just like waiting and seeing all the facts part of me wants to believe mr brown is a gentle giant but there a lot of evidence he not,False,False,False,False,False,False,False,False,False,False
9pr1oE34bIM,we might as well get the next round of riots over w when the police officer is cleared of any wrong doing,False,False,False,False,False,False,False,False,False,False
9pr1oE34bIM,no longer allegedly michael brown in the video confirmed by his family,False,False,False,False,False,False,False,False,False,False
9pr1oE34bIM,well we all know the truth today and yet we still hear the hands up do not shoot bullshit lie see beyonce yet we still see this moniker being used as a reason lie to shoot at cops and outright assassinate them,True,True,False,True,False,False,False,False,False,False
9pr1oE34bIM,love the rap section,False,False,False,False,False,False,False,False,False,False
9pr1oE34bIM,just so everyone knows more white people die from cops than blacks even though blacks get arrested at more than double the rate whites do less than 1 of arrest end in shootings less than 1 4 of people killed by police are black courtesy the fbi statistics maybe we should worry about why blacks commit much more crimes and yet they are out numbered about 5 to 1 in the general population oh and ten years ago the crime rate and employment rate for blacks was better than it is now,False,False,False,False,False,False,False,False,False,False
9pr1oE34bIM,12 28 can someone please turn that into an auto tune rap song by stefan molyneux please,False,False,False,False,False,False,False,False,False,False
9pr1oE34bIM,the guy was a monster he got what he deserved color did not matter anyone that attacks a guy with a gun is going to get shot he did a stupid illegal act tried hurting someone and got blasted give the cop a raise,True,True,False,False,False,False,False,False,False,False
9pr1oE34bIM,molyneux tete de noeud,False,False,False,False,False,False,False,False,False,False
9pr1oE34bIM,moly loooooooooooooooooooooooves cops there are other witnesses also clueless about the riots also about the decades of police violence and repression in the area also ignorant of the effects of marijuana,False,False,False,False,False,False,False,False,False,False
9pr1oE34bIM,the 1 879 people the disliked this video are the problem this man said nothing wrong and until they change which will not happen it will not change the good thing is you are still very out numbered,False,False,False,False,False,False,False,False,False,False
9pr1oE34bIM,if no state no cop no cop no shooting so the state is the problem right anarcho capitalists like steffan should agree with this nonsense,False,False,False,False,False,False,False,False,False,False
9pr1oE34bIM,racist piece of shit you reach for anything to justify murder it is extremely shameful how you slant facts in order to justify your racist and biased views,True,True,False,False,True,False,False,False,False,False
9pr1oE34bIM,dear mr stephen molyneux 40 minutes is a bit long but you are 100 right you respond only after all facts are in by the way i voted the thumb up and the number 5729 did not even blink i have tried the thumb down and must say the same thing happened to be fair thank you for your homework and your hard work obviously you spent a lot of time to present this case to us very nice of you obviously you care very much about your country all the best,False,False,False,False,False,False,False,False,False,False
9pr1oE34bIM,please do a follow up video if you get enough new information thanks for your time and great work as always,False,False,False,False,False,False,False,False,False,False
9pr1oE34bIM,when are people of this country going to learn it is not the police that is the enemy it is the media they are the ones lighting the so called fire and stirring the pot,False,False,False,False,False,False,False,False,False,False
9pr1oE34bIM,as always mr molyneux excellent video,False,False,False,False,False,False,False,False,False,False
9pr1oE34bIM,stop advertising swisher sweets lol you are a racist point blank,True,True,False,False,False,False,False,False,False,False
9pr1oE34bIM,this man has an intelligence the average black man cannot comprehend its like a dog trying to figure out how man makes a house,True,False,False,False,False,True,True,False,False,False
9pr1oE34bIM,i loved your trayvon martin video and i love this one too i wish you could deliver cable news maybe then people would get the truth,False,False,False,False,False,False,False,False,False,False
9pr1oE34bIM,and the robbery video leaves one with more questions than answers he put something on the clerks counter when he entered the store money watch carefully he had something in his hand when he entered plus pulled something out of his pockets money and put it on the counter these surveillance have audio ability there was a conversation at the clerks window as well i am just saying some of the videos posted are longer and have more depth the clerk and him had an exchange at the window we do not know what was said we do not know if the money was sufficient for the items etc,False,False,False,False,False,False,False,False,False,False
9pr1oE34bIM,i hope the next video will be entitled the truth about the ferguson police department and the ferguson riots thanks for the usual quality research but there are two issues match and gasoline riot control of otherwise peaceful protestors homeowners refusing to go inside and members of the press are clear symptoms of something out of the normal for small town police sanford police had similar protests incuding looting but resisted such escalation,False,False,False,False,False,False,False,False,False,False
9pr1oE34bIM,here is another fine ferguson officer man they really got the cream of the crop in that town lol,False,False,False,False,False,False,False,False,False,False
9pr1oE34bIM,the fate of another neglected child would be interesting to know his family background always keep in mind that children emulate social behaviour,False,False,False,False,False,False,False,False,False,False
9pr1oE34bIM,good commentary perceptive and fair,False,False,False,False,False,False,False,False,False,False
9pr1oE34bIM,whether you are right or wrong about the michael brown case has nothing to do with left wing policies please stop conflating the issues,False,False,False,False,False,False,False,False,False,False
9pr1oE34bIM,he was robbing the store and being a big man if you play with fire you will get burnt the police did his job,False,False,False,False,False,False,False,False,False,False
9pr1oE34bIM,link between poor little tryvon martin and little mr brown yeah they were both thug s that tired to beat the white person into the ground and got shot for their effords end of story,True,False,False,False,False,True,True,False,False,False
9pr1oE34bIM,fascinating to hear actual facts especially compared with the twisted nonsense coming out of the main media outlets,False,False,False,False,False,False,False,False,False,False
9pr1oE34bIM,michale brown got what he was asking for the black protestors are racist against whites that is what is happening,True,True,False,True,False,True,True,False,False,False
9pr1oE34bIM,as a white guy if you are really concerned with the plight of the black community which i doubt that you are you should spend some time just hanging around black guys in the community just to see how the world reacts to them and how they react to the world and not just a few times either secondly if you think anyone even hoped up on drugs charges after feeling a gunshot after at first fleeing a shooter what kind of fantasy do you live in you must think blacks will do shit anything with a survival mechanism in this world would not do police officers doing the right thing gives us comfort in our lives and you want to believe the cops story here is another story cop gets out to start some cop harassment type antics as all cops do kid gives him some 18 year old fat fuck that thinks he can whip everybody s ass sass he hits the kid with the door dumb ass kid instead of passing out and getting the officer fired and paid and a few dollars for his injuries pushes the door back officer grabs him by the neck and a scuffle incurs kid fires a punch to his grill black guys hit pretty hard see boxing and the cop sees red opens fire kid runs 15 feet is about how far his ass can get before his body reminds his fat ass he is not a sprinter or maybe the shots are starting to set in now he wants to negotiate cop executes him is it lawful maybe but my story makes more sense,True,True,False,True,True,False,False,False,False,False
9pr1oE34bIM,i think my chief problem with molyneux is that he has great ideals and solid worthwhile goals that he hopes to share with society but cannot seem to embrace the ethical grey ness of human beings he frustrates me with his all or nothing approach to morality and as such i do not believe he is worth listening to as a political strategist which requires recognizing the conditional nature of human psychology and constructing systemic guides to help incentivize positive culture good philosophy crappy political theory,False,False,False,False,False,False,False,False,False,False
9pr1oE34bIM,so sad he looked like such a nice young man,False,False,False,False,False,False,False,False,False,False
9pr1oE34bIM,i believe in those photos the gentle giant and his accomplice are giving gang signs no even if brown did raise his hands in surrender maybe he realized he would blown it could get in trouble and by then officer wilson s adrenaline was running high and reacted officers do not hesitate or they would lose their lives lord knows there is no such thing as a thug that goes to college look at all those angelic professional athletes that keep getting arrested what crap we are being fed i am disgusted,True,False,False,False,False,True,True,False,False,False
9pr1oE34bIM,i cannot tell if this is a racist cop or a dumb guy messing with cops i hate that they make michael brown seem like a holy man and he is not but that does not make it right to kill him it is so confusing,False,False,False,False,False,False,False,False,False,False
9pr1oE34bIM,thank you stefan molyneux for sharing your logical and rational evaluation of the occurrences of this incident,False,False,False,False,False,False,False,False,False,False
9pr1oE34bIM,apparently stefan never read what is the matter with kansas,False,False,False,False,False,False,False,False,False,False
9pr1oE34bIM,this jerk just made up a b s story about skittles and arizona ice tea being components of lean which is actual promethazine a pharmaceutical drug and a easy on to get on the street level this guy is a quake and for you antebellum period dreamers for negro should live beneath you need to realize that your really not much better off statistics would say that there more whites on well fair and more whites committ more violent crimes than anyone so pls come with more white savior b s,False,False,False,False,False,False,False,False,False,False
9pr1oE34bIM,thank you stefan well put,False,False,False,False,False,False,False,False,False,False
9pr1oE34bIM,how da fuck do this gay ass bald white frenchy nigga going to set hisself up as a dang judge a this whole criminal conspiracy micheal brown had his mothafuckin hands in the air son if you so smart then you should know that when a nigga has his hands in the mothafuckin air that is a sign showin he was innocent of tha crime sorry for the cussin but that shit be internationally recognized as an indication of innocence on the part of the perpetrator what you all niggas in the media have here is a plain old fashioned example a murder in the first degree on the part a mr officer darren wilson for takin the life a this nigga who was a college student niggas at kent state be protestin they get they asses shot and it is a historic event michael brown shot dead in the street while he takin part in the ferguson protests and you all media mothafuckas try to explain it away,True,True,False,False,True,False,False,False,False,False
9pr1oE34bIM,why did not they interview the constitution workers who where caught on tape saying why did you shot he had his hands up,False,False,False,False,False,False,False,False,False,False
9pr1oE34bIM,who is going to pay the store owner for the cigars big gigantic mike stole,False,False,False,False,False,False,False,False,False,False
9pr1oE34bIM,ireland v england riots 1995 hq,False,False,False,False,False,False,False,False,False,False
9pr1oE34bIM,thank you right on black people are going to vote 100 democrat this year that is what all of this race baiting is all about democrats are rallying their base smh,False,False,False,False,False,False,False,False,False,False
9pr1oE34bIM,wow common sense in 20014 how refreshing great job stefan molyneux,False,False,False,False,False,False,False,False,False,False
9pr1oE34bIM,why do you focus on how he rolls his blunt mj is not the because it just so happens to be that much like non criminal types the criminal types also smoke pot pot has absolutely nothing to do with any of this the fact that he was walking and not driving is more important why bring pot into this as some relative intel yes criminals have a tendency to smoke pot criminals also tend to smoke cigarettes or drink,False,False,False,False,False,False,False,False,False,False
