VideoId,Text,IsToxic,IsAbusive,IsThreat,IsProvocative,IsObscene,IsHatespeech,IsRacist,IsNationalist,IsSexist,IsReligiousHate
4rCweDxDqdw,the ugly truth if you talk like a thug act like a thug walk like a thug and live like a thug then you will die like a thug live by the sword die by the sword do not hate the player hate the game this was not an innocent little child just walking down the street who got shot in the back if we cannot blame the parents then we must look at the individual who in this case was an adult what kind of music did he listen to what kind of videos did he view who were his role models how did his environment affect him who were the enablers who did he associate with but most importantly when will he be accountable for his own actions unfortunately on this day he chose the wrong pathway to his fate you cannot rob a store and call it shoplifting heck you might as well call it borrowing without permission this was not his first crime and there were probably many unrecorded not caught negative actions by mike brown mb you cannot assault another human being without consequences or should we say he was just playing it was no big deal or it was childish get real folks the riots looting attacks and threats has nothing to do with mb it has to do with a culture who feel they are entitled and will use any excuse or propaganda to find any excuse to commit crimes in the name of no justice no peace hands up do not shoot please this culture needs to stop pants on the ground pants on the ground looking like a fool with your pants on the ground hat turned sideways gold in your mouth looking like a fool with your pants on the ground let me say this is not about race this is not about lack of justice justice naturally in the street will usually end in tragedy this was the result of an immature with no respect thug who believed he could use his size to intimidate he probably did it in school and we know he did it in the street real parents or those around them would have not called what mb did childish that was not nor is childish behaviors his behaviors were felonious and criminal and to be frank would have probably cost him his life elsewhere at a different time real parents would have stated this was my son what he did was wrong in this store and to the clerk if in fact the evidence shows my son assaulted this officer and posed a threat by going after the officer before the shots were fired then may our son rest in peace as his actions we do not condone but this consequence was just due to his own choices and actions we unconditionally love our son however we also forgive the officer we apologize to the store clerk and we hope as a family and people can move on only to learn our actions and how we live dictate our consequences be it positive or negative we would also like to support alternate methods in the event this does happen again using non lethal weapons such as rubber bullets taser mace etc and to those who truly support change no silence no violence there is no sugar coat here as a human as a race we need to be accountable for what we say and do lastly if the officer was racist and he did shoot mb without rhyme or reason or if he in fact just targeted mb dj because they were black and decided to gun down mb in the back and front even though he surrendered peacefully with his hands raised then i would side with mb and those who support the because but unfortunately the evidence thus far does not support the above paragraph question 1 would this still be the reaction if the officer were a female question 2 would this still be the reaction if the officer were black african american question 3 would this still be the reaction if mike brown was gunned down by a peer of his own race question 4 would this still be the reaction if mike brown were white question 5 would this still be the end result death if mike brown was productive at home work or school other than running the streets to the people nothing in the world is more dangerous than sincere ignorance and conscientious stupidity martin luther king jr i think it is safe to say we are living in dangerous times because of this simple fact proving this martin luther king jr s quote unfortunately it is coming from his own race and those supporting a lost because to the people who cry wolf mj please repost,True,False,False,False,False,True,True,False,False,False
4rCweDxDqdw,people say blacks play the victim but according to the comments its our fault that the elected officals are racists whites had a good thing going in missouri but they had to be racist all white folks do is point fingers take these punk bitches out of power we goin back to racism deport everyone else,True,False,False,False,False,True,True,False,False,False
4rCweDxDqdw,protest was converted into riot because majority of people wanted it do not be fooled by politicians they play serious games with common man take care everyone and save humanity peace,False,False,False,False,False,False,False,False,False,False
4rCweDxDqdw,worst testtube video ever some of the inequality is by choice white flight and or via change in demographics etc but the remaining residents do have a say they vote and can put up their own nominees and go to city council meetings and put their grievances before the councilmen etc besides if this is the supposedly post racial era in america what does the race of leaders matter oh by the way the title asked what really caused the riots seems from most accounts the answer is out of town lawbreakers,False,False,False,False,False,False,False,False,False,False
4rCweDxDqdw,that punk did not get blasted for no reason if that cop did not shoot him someone else would have,True,True,False,False,False,False,False,False,False,False
4rCweDxDqdw,a lot of people and the entire media is missing this huge crucial point why was micheal brown even stopped in the first place the day it happened the officer said that it was because mike brown was walking in the street then a few days later it was because he had robbed a convenience store despite the fact that owner himself says that his store was never robbed the officer was apparently in fear for his life the pd claims he was seriously injured in the altercation with mike brown even though there is a video showing the officer perfectly fine standing by mike s body an hour after the shooting also mike s body was 35 feet away from where the officer was when mike apparently charged at him man the police are full of shit if you cannot see that this shit was made up then you are either a bigot or just a fucking idiot,True,True,False,False,True,False,False,False,False,False
4rCweDxDqdw,you can say black this piece came off a bit stiff due to the repeated use of african american,False,False,False,False,False,False,False,False,False,False
4rCweDxDqdw,i live in st louis and it is scary,False,False,False,False,False,False,False,False,False,False
4rCweDxDqdw,ferguson just like any american city is not a prison if those or any other residents feel that are mistreated discriminated against or subjected to illegall search and seizure then my advice is move our country is vast and i am confident they can find somewhere in our great nation where they can find a place to be happy and successful,False,False,False,False,False,False,False,False,False,False
4rCweDxDqdw,i do believe that the correct word is caucasian not white let us be correct in every regard great report though i love the videos,False,False,False,False,False,False,False,False,False,False
4rCweDxDqdw,in france when i was in the military they taught me that we could use a lethal weapon only if the other uses a similar equal or superior lethal weapon against us or against another to defend ourselves using a superior weapon is not never allowed i think that is a noble french concept b,False,False,False,False,False,False,False,False,False,False
4rCweDxDqdw,perhaps you should start teaching blacks that law and education is important instead of treating them as special snowflakes,True,False,False,False,False,True,True,False,False,False
4rCweDxDqdw,while i agree with most of your report and i certainly think that the events that went down in ferguson need to be investigated your statistics to support a targeting of a particular race by number of stops and searches can certainly be explained away by the fact that most of the population in that region is of a particular race given a greater opportunity that someone who is stopped is most likely going to be of that race i think further analysis would need to be conducted to make that collation i am not saying race is not a factor i am saying statistics can be misleading and need to be considered thoughtfully before stating them as support for a statement,False,False,False,False,False,False,False,False,False,False
4rCweDxDqdw,its funny doctors push drugs its legal even though prescription drugs are abused the most whereas minorities get locked up for years because of marijuana known to be beneficial to the economy the war on drugs started with the government who still supplies the streets to this day racial profiling is stupid caucasians commit the most mass shootings i do not see them being searched before they go in malls movie theaters schools etc,False,False,False,False,False,False,False,False,False,False
4rCweDxDqdw,so you are implying that because most of ferguson is black but most of their elected or appointed officials are white that it means that the majority of people in ferguson is not represented at all that they mostly black population would not happen to have voted for or support the white officials and just because its median income is lower than that of mo or the us as a whole is that because its population is mostly black or is it just a statistic,False,False,False,False,False,False,False,False,False,False
4rCweDxDqdw,ridiculous liberal tripe meant to divide us along race class barriers even more if blacks i refuse to use the word african american are oppressed by local government then the community should band together and vote them out vote more blacks in this is why we live in a democratic republic sorry most of your arguments are nothing more than excuses and your criminal stats are the result of a large black community 68 blacks really need to stop listening to democrats who preach a you cannot win because the deck is stacked against you oppressive lifestyle they will never rise above their current conditions if they cling to liberal excuses it is not the color of your skin its the overall presentation,False,False,False,False,False,False,False,False,False,False
4rCweDxDqdw,someone has to say this so i will with the way most black people behave no wonder ferguson is such a shitty place most black people in the us are so fucking lazy i am saying this because of countless examples from my life 1 my grandmother got a black house nurse once and the bitch did nothing all day when my grandmother complained to the agency they sent a different woman was not black that cleaned the entire house in 4 hours 2 my mom works at a hospital as a nurse and all her black co workers constantly do nothing and are lazy now once again not all black people are like this one of my best friends is black and i like him like a brother but most of them are the fucks expect to get everything they want only because their ancestors were once slaves well hitler killed most of my ancestors do you see me with sagging pants and crying like a stupid bitch about it like those stupid black people the inequality of representation is probably because again black people are generally lazy or lack the skills required to hold such positions the household income ties into my previous point lazy lacking skill lower income jobs the dropout rate from school need to be taken against the black people at ferguson because once again how will you hold a high paying job if you did not even graduate fucking high school the 80 worse healthcare is once again tied into the low income more money better doctors as for the inequality of enforcement i have to give you that one that is completely unfair however when looking at black officers they frisk mostly black people as well hmmmm interesting maybe,True,True,False,True,True,True,True,False,False,False
4rCweDxDqdw,i might be wrong but when a majority of the black community do not vote would not it make sense for there to be an inequality in the city government,False,False,False,False,False,False,False,False,False,False
4rCweDxDqdw,is there something wrong with her voice,False,False,False,False,False,False,False,False,False,False
4rCweDxDqdw,the more those people fuck up america the more american will fucking hate them,True,True,False,False,True,False,False,False,False,False
4rCweDxDqdw,bill cosby caused them,False,False,False,False,False,False,False,False,False,False
4rCweDxDqdw,the us justice department has audited the ferguson police department and found 180 counts of excessive use of police force against african americans from 2009 2014 in addition they found 7 emails containing discriminatory language on department computers the federal government is pursuing a criminal case against the ferguson police department i wonder if bob mcculloch will try to defend this one,False,False,False,False,False,False,False,False,False,False
4rCweDxDqdw,is there something wrong with the audio,False,False,False,False,False,False,False,False,False,False
4rCweDxDqdw,that is just flat out racist to say one race cannot represent another equally if majority blacks voted for the white people does that mean the blacks that voted did not vote for their own best interest and that the elected white official cannot represent the black voters that put him her in office,False,False,False,False,False,False,False,False,False,False
4rCweDxDqdw,the report on the inequality of enforcement statistics can be found in the description and here to those who are questioning the math here please check it for yourself we are not here to teach basic algebra these numbers are not proportional our video scratches the surface and we do encourage you to do supplemental research on their own if you wish to know more,False,False,False,False,False,False,False,False,False,False
4rCweDxDqdw,what is with all the dislikes white people are that offended you thought racism was not an issue anymore think again,True,False,False,False,False,True,True,False,False,False
4rCweDxDqdw,how come they call the blacks african americans but not european american to the whites,False,False,False,False,False,False,False,False,False,False
4rCweDxDqdw,did the idiot reporter do the survey on the percent of blacks that are involved in the following gang activities shoplifting car jacking robberies robberies with assault teenage pregnancies,True,True,False,False,False,True,True,False,False,False
4rCweDxDqdw,here there is no racism here you are all equally worthless full metal jacket,False,False,False,False,False,False,False,False,False,False
4rCweDxDqdw,testtube can you please explain to me how blacks get stopped and searched more than whites if whites get make up 29 of the population and get searched 6 9 of the time while blacks make up 67 of the population and get searched 12 1 of the time it is pretty obvious that whites are likely to get searched more do you want me to explain it further why that is or can you find someone in your team that actually remembers basic grade school math i could go on and on about what is wrong about this video but it seems to have been already explained by others seriously i do enjoy watching your channel but the bias is strong with this one and almost made me want to unsubscribe,False,False,False,False,False,False,False,False,False,False
4rCweDxDqdw,if the majority of the people in ferguson are african american than why are their elected officials not african american the mayor city council and police chief are all elected officials are the people in the community not stepping up to fill those roles,False,False,False,False,False,False,False,False,False,False
4rCweDxDqdw,my least favorite test tube video so far,False,False,False,False,False,False,False,False,False,False
4rCweDxDqdw,heard a billionaire funded these organised riots what a fucken suck joke,True,True,False,False,True,False,False,False,False,False
4rCweDxDqdw,please slow down i cannot tell if they sped up ms scully or if she was talking really quickly great video with great information it was just a little fast,False,False,False,False,False,False,False,False,False,False
4rCweDxDqdw,while i do not agree with police action to kill the boy but that does not mean you can protest by looting and destroying your own neighbourhood that is stupid because it makes people do not want to support your struggle,False,False,False,False,False,False,False,False,False,False
5vF4si3hoRA,fucking savages protest sumthing real like how your government is robbing you and sendin your kids to an elegal war you are the laughing stock of america congrats,True,True,False,False,False,False,False,False,False,False
5vF4si3hoRA,i just came here to read the racist comments lol,False,False,False,False,False,False,False,False,False,False
5vF4si3hoRA,sure some of the people protesting are actually protesting for what they believe in but then you have those people that are taking advantage of a sad situation just to cause so much chaos and damage to a hurting community,False,False,False,False,False,False,False,False,False,False
5vF4si3hoRA,we need to come togather,False,False,False,False,False,False,False,False,False,False
5vF4si3hoRA,do not call peacefully protest when you burn down a car lol,False,False,False,False,False,False,False,False,False,False
5vF4si3hoRA,and in this section ladies and gentlemen you will see black people misbehaving i wonder what would happen if everyone rioted when court decisions do not go their way,True,False,False,False,False,True,True,False,False,False
5vF4si3hoRA,dirtbags all of them including cnn,True,True,False,False,False,False,False,False,False,False
5vF4si3hoRA,why were protesters throwing stuff at the reporters,False,False,False,False,False,False,False,False,False,False
8HB18hZrhXc,guy 0 34 just got a hard on,False,False,False,False,False,False,False,False,False,False
8HB18hZrhXc,as i watched i kept muttering shoot shoot pull the trigger rubber bullets hurt like a mfer,True,True,False,True,False,False,False,False,False,False
8HB18hZrhXc,send them to france,False,False,False,False,False,False,False,False,False,False
8HB18hZrhXc,fun fact they did not have live ammo in those guns they had rubber slugs,False,False,False,False,False,False,False,False,False,False
8HB18hZrhXc,how fucking brain dead do you have to be to let the nazi police scum bags just take you in,True,True,False,True,False,False,False,False,False,False
8HB18hZrhXc,dis be furgusun in de unitid stateth of murka retard starts violent protest and then tries to pawn off the police state lie when the cops arrive,True,True,False,True,False,False,False,False,False,False
8HB18hZrhXc,god bless the police,False,False,False,False,False,False,False,False,False,False
8HB18hZrhXc,usa land of the free baby hahahaha all you people not living in usa should be thankful everyday this is the worse country on earth,True,False,False,False,False,True,True,True,False,False
8HB18hZrhXc,was this in virginia,False,False,False,False,False,False,False,False,False,False
8HB18hZrhXc,wow need to get your shit straight they never had there weapons pointed at any one in this vid they were at the ready position due to a riot and very under understandable course of action for any one who knows anything,False,False,False,False,False,False,False,False,False,False
8HB18hZrhXc,no dumber people on earth then americans,True,False,False,False,False,True,True,True,False,False
8HB18hZrhXc,at 16 screw the price of crap that thinks he is cool to disrespect the american flag,True,True,False,False,False,False,False,False,False,False
8HB18hZrhXc,shoot first ask questions later hahahahahaha,True,True,False,True,False,False,False,False,False,False
8HB18hZrhXc,what police that was the army,False,False,False,False,False,False,False,False,False,False
8HB18hZrhXc,should have shot,True,True,False,True,False,False,False,False,False,False
8HB18hZrhXc,a true dictatorship let us wait and check which of the coutries will start sanctioning on you s government i guess none of countries because usa is a corrupted all of countries in the world except russia and china,True,True,False,True,False,False,False,False,False,False
8HB18hZrhXc,i am at this point where i think if a cop points a gun at me i should just you know do as i am told that something i did provoked that,False,False,False,False,False,False,False,False,False,False
8HB18hZrhXc,techno party,False,False,False,False,False,False,False,False,False,False
8HB18hZrhXc,awesome job from our law enforcement now send off to disrupt tear down all the islamic extremist radicals in america thanks,True,False,False,False,False,True,False,False,False,True
8HB18hZrhXc,to bad those weapons were not discharged,True,True,False,True,False,False,False,False,False,False
8HB18hZrhXc,not once did obama show hos face in these cities yet they supported him sad,False,False,False,False,False,False,False,False,False,False
8HB18hZrhXc,wait so who was rioting again the people standing boredly on the sidewalk or the guys with guns in the middle of traffic,False,False,False,False,False,False,False,False,False,False
8HB18hZrhXc,police cleaned that mess up quick nice,True,True,False,True,False,False,False,False,False,False
8HB18hZrhXc,i find this satisfying for some reason,True,True,False,True,False,False,False,False,False,False
8HB18hZrhXc,confederation ill be back,False,False,False,False,False,False,False,False,False,False
8HB18hZrhXc,those guns use rubber bullets stupid russian news channel,True,True,False,False,False,False,False,False,False,False
8HB18hZrhXc,perfect police,False,False,False,False,False,False,False,False,False,False
8HB18hZrhXc,protesters suck,True,True,False,False,True,False,False,False,False,False
8HB18hZrhXc,a rocket launcher will take care of that lightly armored vehicle lol,True,True,False,True,False,False,False,False,False,False
8HB18hZrhXc,too bad that these were riot shotguns and not loaded with live rounds,True,True,False,True,False,False,False,False,False,False
8HB18hZrhXc,time to test the police guns fire fire,True,True,False,True,False,False,False,False,False,False
8HB18hZrhXc,buy ak47 shoot all usa copa,True,True,True,False,False,False,False,False,False,False
8HB18hZrhXc,ah beautiful,True,True,False,True,False,False,False,False,False,False
8HB18hZrhXc,kill all protesters,True,True,True,False,False,False,False,False,False,False
8HB18hZrhXc,i think that all you guys are doing is profiting of all these standoff s and not caring about one side or the other,False,False,False,False,False,False,False,False,False,False
8HB18hZrhXc,blue lives let us matter send those blm commies our of our streets,True,False,False,False,False,True,True,False,False,False
8HB18hZrhXc,i am with cops those protesters steal and destroy things they are not solving shit,True,True,False,False,True,False,False,False,False,False
8HB18hZrhXc,and here you see it they impose gunlaws in fact even if you had a machine gun people could not do anything against the police they have cars and body protection like tanks just wanted to say,False,False,False,False,False,False,False,False,False,False
9pr1oE34bIM,our shit serving media concocts a story white cop kills an innocent black teenager which is bullshit to get the black community up in arms they burn shit down more stories for these useless talking heads to get in front of a camera with at least once a week i see a black on white crime reported on the news no national attention no federal involvement wtf black men need to stand up and be fathers and stop looking for excuses fuck you all all you all,True,True,False,False,True,True,True,False,False,False
9pr1oE34bIM,what does this video have to do with what actually happen you are simply trying to smear this young man s image so what he wanted to be a rapper so what he stole some cigars nothing you have side in this video deserves a death sentence also now that they have released new video of officer wilson showing that he had no injuries it shows that officer wilson is not being truthful about the incident perhaps you need to wait until all the details are out before you post a bias video if you are going to post a video make sure that it is accurate not to mention that you had more than just his friend the criminal who stated that brown was giving up you had both black and white witnesses who had nothing to do with the incident who stated that he had his hands up and was surrendering when wilson shot him,False,False,False,False,False,False,False,False,False,False
9pr1oE34bIM,funny to thing the government can be trusted to judge itself fucking disgusting,True,True,False,True,False,False,False,False,False,False
9pr1oE34bIM,what is the relevance of marijuana here the autopsy shows the entry wounds spread out over the body in close range the spread would be tight most hitting the same region and most likely the chest area but from long range the spread would be dispersed as we see in the report and the wounds are on the underside of the arms only exposed if the arms are raised or out in a gesture of peace ie my hands are empty and away from my body pose this plus there were no powder burns on the body he was far away,False,False,False,False,False,False,False,False,False,False
